,Unnamed: 0,full_name,gender,type,state,district,senate_class,party,url,twitter,facebook,youtube,youtube_id,bioguide_id,handle,post_id,text,post_text,shared_text,time,image,video,video_thumbnail,video_id,likes,comments,shares,post_url,link,user_id,username,is_live,images
1,2,Karen Bass,F,rep,CA,37,,Democrat,https://bass.house.gov,RepKarenBass,RepKarenBass,RepKarenBass,UCQZg7oxkV3Yag2emYPLhT2g,B001270,RepKarenBass,6164027456956677,"Children should not be criminalized for being children.

Thank you Bryan Stevenson for your testimony today.","Children should not be criminalized for being children.

Thank you Bryan Stevenson for your testimony today.",,2021-05-13 22:45:02.000000,,https://video-iad3-2.xx.fbcdn.net/v/t42.1790-2/183959989_2940509682888734_5738613365026585190_n.mp4?_nc_cat=111&ccb=1-3&_nc_sid=985c63&efg=eyJ2ZW5jb2RlX3RhZyI6InN2ZV9zZCJ9&_nc_ohc=OT7JQ-aTIr8AX84N0ti&_nc_rml=0&_nc_ht=video-iad3-2.xx&oh=5939434838d846321aed90bfeb36c808&oe=609E7169,https://scontent-iad3-2.xx.fbcdn.net/v/t15.5256-10/cp0/e15/q65/s320x320/175722785_539724383861231_1930002229501919878_n.jpg?_nc_cat=111&ccb=1-3&_nc_sid=ccf8b3&_nc_ohc=idx-5ZasnugAX8GcJpK&_nc_ht=scontent-iad3-2.xx&tp=9&oh=992f442b2d9572ece7107bfbb4a1646f&oe=60C1F087,539723980527938,25,3,0,https://facebook.com/RepKarenBass/videos/539723980527938,,190867440939405,Congressmember Karen Bass,False,[]
55,40,Anna G. Eshoo,F,rep,CA,18,,Democrat,https://eshoo.house.gov,RepAnnaEshoo,RepAnnaEshoo,RepAnnaEshoo,UCjRvhco2d59GBgA78IIIaYQ,E000215,RepAnnaEshoo,10159625523634228,"Through the Emergency Broadband Benefit passed by Congress, qualifying families can apply to receive $50 off their monthly internet bill.

Open enrollment in the program started today. Find out if you qualify for monthly internet bill savings here: https://getemergencybroadband.org/

GETEMERGENCYBROADBAND.ORG
The Emergency Broadband Benefit Program","Through the Emergency Broadband Benefit passed by Congress, qualifying families can apply to receive $50 off their monthly internet bill.

Open enrollment in the program started today. Find out if you qualify for monthly internet bill savings here: https://getemergencybroadband.org/","GETEMERGENCYBROADBAND.ORG
The Emergency Broadband Benefit Program",2021-05-13 22:27:48.000000,,,,,3,0,0,https://facebook.com/RepAnnaEshoo/posts/10159625523634228,https://getemergencybroadband.org/,174979964227,Congresswoman Anna Eshoo,False,[]
210,190,Tom Rice,M,rep,SC,7,,Republican,https://rice.house.gov,RepTomRice,reptomrice,RepTomRice,UCEmPVQphMGoXAfWJli68BEw,R000597,reptomrice,3975038319252878,"Tomorrow morning we have a leadership election to replace Liz Cheney. The two contestants are:

Chip Roy of Texas, a Freedom Caucus member who is among the most conservative members of Congress. His lifetime score from Heritage Action is 96%, one of the very highest in Congress. According to the website 538, Chip voted with Trump in Congress 90% of the time.

Elise Stefanik of New York. Elise is among the most liberal Republicans in Congress. Her lifetime score from Heritage action is 48% making her the 6th lowest out of approximately 200 Republicans. According to the website 538, she voted with Trump only 78% of the time.

Trump has endorsed Stefanik for Republican Conference Chair and said Roy will lose his seat in a primary, because Roy voted to certify the election.

Who would you support for Republican Conference Chair?","Tomorrow morning we have a leadership election to replace Liz Cheney. The two contestants are:

Chip Roy of Texas, a Freedom Caucus member who is among the most conservative members of Congress. His lifetime score from Heritage Action is 96%, one of the very highest in Congress. According to the website 538, Chip voted with Trump in Congress 90% of the time.

Elise Stefanik of New York. Elise is among the most liberal Republicans in Congress. Her lifetime score from Heritage action is 48% making her the 6th lowest out of approximately 200 Republicans. According to the website 538, she voted with Trump only 78% of the time.

Trump has endorsed Stefanik for Republican Conference Chair and said Roy will lose his seat in a primary, because Roy voted to certify the election.

Who would you support for Republican Conference Chair?",,2021-05-13 22:19:05.000000,https://scontent-iad3-2.xx.fbcdn.net/v/t1.6435-9/fr/cp0/e15/q65/186434691_3975038272586216_6527931249638273578_n.jpg?_nc_cat=107&ccb=1-3&_nc_sid=110474&_nc_ohc=HX7gbX99g58AX-lSXDm&_nc_ht=scontent-iad3-2.xx&tp=14&oh=44489ce11a5af48d0c897dff6f8d65ca&oe=60C54C41,,,,11,48,0,https://facebook.com/reptomrice/posts/3975038319252878,,403403083083104,Congressman Tom Rice,False,['https://scontent-iad3-2.xx.fbcdn.net/v/t1.6435-9/fr/cp0/e15/q65/186434691_3975038272586216_6527931249638273578_n.jpg?_nc_cat=107&ccb=1-3&_nc_sid=110474&_nc_ohc=HX7gbX99g58AX-lSXDm&_nc_ht=scontent-iad3-2.xx&tp=14&oh=44489ce11a5af48d0c897dff6f8d65ca&oe=60C54C41']
331,247,Jimmy Panetta,M,rep,CA,20,,Democrat,https://panetta.house.gov,RepJimmyPanetta,RepJimmyPanetta,,UCmw-aERG51C96edMDPN7fXQ,P000613,RepJimmyPanetta,1226701004445696,I introduced the Monarch and Pollinator Highway Act and the MONARCH Act with Senator Jeff Merkley to protect the Western Monarch from further population decline. Glad to have the support of advocates like the Center for Biological Diversity as we fight to safeguard this critical pollinator.,I introduced the Monarch and Pollinator Highway Act and the MONARCH Act with Senator Jeff Merkley to protect the Western Monarch from further population decline. Glad to have the support of advocates like the Center for Biological Diversity as we fight to safeguard this critical pollinator.,,2021-05-13 22:07:36.000000,https://scontent-iad3-2.xx.fbcdn.net/v/t1.6435-9/fr/cp0/e15/q65/185915806_1226700971112366_2203427523340487200_n.jpg?_nc_cat=111&ccb=1-3&_nc_sid=8024bb&_nc_ohc=Xdst5TFGru4AX8aas8w&_nc_ht=scontent-iad3-2.xx&tp=14&oh=64d554f52b652f46064d15a50dbd914e&oe=60C55E49,,,,67,5,0,https://facebook.com/RepJimmyPanetta/posts/1226701004445696,,198585430590597,Rep. Jimmy Panetta,False,['https://scontent-iad3-2.xx.fbcdn.net/v/t1.6435-9/fr/cp0/e15/q65/185915806_1226700971112366_2203427523340487200_n.jpg?_nc_cat=111&ccb=1-3&_nc_sid=8024bb&_nc_ohc=Xdst5TFGru4AX8aas8w&_nc_ht=scontent-iad3-2.xx&tp=14&oh=64d554f52b652f46064d15a50dbd914e&oe=60C55E49']
332,247,Jimmy Panetta,M,rep,CA,20,,Democrat,https://panetta.house.gov,RepJimmyPanetta,RepJimmyPanetta,,UCmw-aERG51C96edMDPN7fXQ,P000613,RepJimmyPanetta,1226697731112690,Honored to stand in solidarity with the family of Army Specialist Vanessa Guillen as my colleagues and I reintroduced the #IAmVanessaGuillen Act to help survivors of military sexual trauma heal and hold perpetrators accountable.,Honored to stand in solidarity with the family of Army Specialist Vanessa Guillen as my colleagues and I reintroduced the #IAmVanessaGuillen Act to help survivors of military sexual trauma heal and hold perpetrators accountable.,,2021-05-13 22:01:33.000000,https://scontent-iad3-2.xx.fbcdn.net/v/t1.6435-9/fr/cp0/e15/q65/186464246_1226697697779360_8636358533907419678_n.jpg?_nc_cat=102&ccb=1-3&_nc_sid=8024bb&_nc_ohc=9ZC0nX0mxeYAX8VEXRK&_nc_ht=scontent-iad3-2.xx&tp=14&oh=d8427e6524d57df762af9dea7f68b6a0&oe=60C3ED86,,,,45,3,0,https://facebook.com/RepJimmyPanetta/posts/1226697731112690,,198585430590597,Rep. Jimmy Panetta,False,['https://scontent-iad3-2.xx.fbcdn.net/v/t1.6435-9/fr/cp0/e15/q65/186464246_1226697697779360_8636358533907419678_n.jpg?_nc_cat=102&ccb=1-3&_nc_sid=8024bb&_nc_ohc=9ZC0nX0mxeYAX8VEXRK&_nc_ht=scontent-iad3-2.xx&tp=14&oh=d8427e6524d57df762af9dea7f68b6a0&oe=60C3ED86']
169,175,Jackie Walorski,F,rep,IN,2,,Republican,https://walorski.house.gov,RepWalorski,RepJackieWalorski,repwalorski,UC8fsSDjVJ_VnCF3ccx3Lkng,W000813,RepJackieWalorski,4642461989145888,"I asked U.S. Trade Representative Katherine Tai to provide targeted relief to U.S. manufacturers while maintaining strong measures to confront China's unfair trade practices.

Many American companies and their workers are being disadvantaged by tariffs because they manufacture here in the United States. Without commonsense relief, these tariffs will hurt our economic recovery.","I asked U.S. Trade Representative Katherine Tai to provide targeted relief to U.S. manufacturers while maintaining strong measures to confront China's unfair trade practices.

Many American companies and their workers are being disadvantaged by tariffs because they manufacture here in the United States. Without commonsense relief, these tariffs will hurt our economic recovery.",,2021-05-13 21:58:40.000000,,https://video-iad3-2.xx.fbcdn.net/v/t42.1790-2/183957353_497514001603632_8260988124092941924_n.mp4?_nc_cat=107&ccb=1-3&_nc_sid=985c63&efg=eyJ2ZW5jb2RlX3RhZyI6InN2ZV9zZCJ9&_nc_ohc=Bki9x92s7uwAX8gC0GL&_nc_rml=0&_nc_ht=video-iad3-2.xx&oh=768ace4441b0a1866c4befa3ef7b2f38&oe=609E780C,https://scontent-iad3-2.xx.fbcdn.net/v/t15.13418-10/cp0/e15/q65/s320x320/184139188_585178695723010_3799594721697170596_n.jpg?_nc_cat=106&ccb=1-3&_nc_sid=ccf8b3&_nc_ohc=lmk0TB6DvYwAX-DW7dV&_nc_ht=scontent-iad3-2.xx&tp=9&oh=3b5cb4c937140c140a485ae2c57aaea7&oe=60C4EA1F,302824077968762,7,1,0,https://facebook.com/RepJackieWalorski/videos/302824077968762,,466876036704525,Rep. Jackie Walorski,False,[]
348,260,Brian J. Mast,M,rep,FL,18,,Republican,https://mast.house.gov,repbrianmast,repbrianmast,repbrianmast,,M001199,repbrianmast,2954615298152570,"The CRISIS at our southern border has turned into an INVASION because of Vice President Harris’s inaction.

DAILYCALLER.COM
Still No Press Conference — 50 Days Since Kamala Harris Was Named ‘Border Czar’",The CRISIS at our southern border has turned into an INVASION because of Vice President Harris’s inaction.,"DAILYCALLER.COM
Still No Press Conference — 50 Days Since Kamala Harris Was Named ‘Border Czar’",2021-05-13 21:35:49.000000,,,,,28,27,14,https://facebook.com/repbrianmast/posts/2954615298152570,https://dailycaller.com/2021/05/13/kamala-harris-southern-border-czar-50-days-conference-migrant/,1840872046193573,Congressman Brian Mast,False,[]
245,205,J. Hill,M,rep,AR,2,,Republican,https://hill.house.gov,RepFrenchHill,RepFrenchHill,,UCT8uWroJtkwSsCJlVg0IKvQ,H001072,RepFrenchHill,3891640417597893,"In President Joe Biden’s address to a joint session of Congress, he detailed his plans to spend nearly 6 trillion dollars to fast-track his infrastructure plan, a Green New Deal, and programs that expand the government’s role in our daily lives.

From an already excessive $1.9 trillion partisan and untargeted spending bill to the Administration’s all-of-the-above ‘infrastructure’ vision, President Biden has shown his true colors – admitting that bipartisanship is a drag on his tax-and-spend, job-killing agenda.","In President Joe Biden’s address to a joint session of Congress, he detailed his plans to spend nearly 6 trillion dollars to fast-track his infrastructure plan, a Green New Deal, and programs that expand the government’s role in our daily lives.

From an already excessive $1.9 trillion partisan and untargeted spending bill to the Administration’s all-of-the-above ‘infrastructure’ vision, President Biden has shown his true colors – admitting that bipartisanship is a drag on his tax-and-spend, job-killing agenda.",,2021-05-13 21:30:38.000000,https://scontent-iad3-2.xx.fbcdn.net/v/t1.6435-9/fr/cp0/e15/q65/186466513_3891639254264676_8603497377562036775_n.jpg?_nc_cat=108&ccb=1-3&_nc_sid=110474&_nc_ohc=30-yaz_Ln1oAX_C4TAu&_nc_ht=scontent-iad3-2.xx&tp=14&oh=2ba63497cfd5f4d266aa2a834471f699&oe=60C36700,,,,16,35,0,https://facebook.com/RepFrenchHill/posts/3891640417597893,,727280547367245,Congressman French Hill,False,['https://scontent-iad3-2.xx.fbcdn.net/v/t1.6435-9/fr/cp0/e15/q65/186466513_3891639254264676_8603497377562036775_n.jpg?_nc_cat=108&ccb=1-3&_nc_sid=110474&_nc_ohc=30-yaz_Ln1oAX_C4TAu&_nc_ht=scontent-iad3-2.xx&tp=14&oh=2ba63497cfd5f4d266aa2a834471f699&oe=60C36700']
186,183,Sean Patrick Maloney,M,rep,NY,18,,Democrat,https://seanmaloney.house.gov,RepSeanMaloney,RepSeanMaloney,,UCNiVzzf4Vz-vCMPBcnjGuXQ,M001185,RepSeanMaloney,4365654703447318,"Thank you to the tens of thousands of callers who joined me on my Telephone Town Hall to discuss the pandemic, the vaccine, and our reopening. As always, I want to give a quick reminder about my talented team of caseworkers. I’m always happy to answer your questions and hear about the issues that are most important to you. If you need assistance or have any more questions, don’t hesitate to reach out to my office at 845-561-1259. We’re here to help.","Thank you to the tens of thousands of callers who joined me on my Telephone Town Hall to discuss the pandemic, the vaccine, and our reopening. As always, I want to give a quick reminder about my talented team of caseworkers. I’m always happy to answer your questions and hear about the issues that are most important to you. If you need assistance or have any more questions, don’t hesitate to reach out to my office at 845-561-1259. We’re here to help.",,2021-05-13 21:15:07.000000,https://scontent-iad3-2.xx.fbcdn.net/v/t1.6435-9/fr/cp0/e15/q65/185510335_4365654543447334_5080764240228111877_n.jpg?_nc_cat=101&ccb=1-3&_nc_sid=110474&_nc_ohc=0CGDfaSHnE8AX-TYnnd&_nc_ht=scontent-iad3-2.xx&tp=14&oh=2f6811ad2dbb9a78e51cb36978a7cef0&oe=60C5925A,,,,170,5,0,https://facebook.com/RepSeanMaloney/posts/4365654703447318,,551199354892891,Rep. Sean Patrick Maloney,False,['https://scontent-iad3-2.xx.fbcdn.net/v/t1.6435-9/fr/cp0/e15/q65/185510335_4365654543447334_5080764240228111877_n.jpg?_nc_cat=101&ccb=1-3&_nc_sid=110474&_nc_ohc=0CGDfaSHnE8AX-TYnnd&_nc_ht=scontent-iad3-2.xx&tp=14&oh=2f6811ad2dbb9a78e51cb36978a7cef0&oe=60C5925A']
22,13,André Carson,M,rep,IN,7,,Democrat,https://carson.house.gov,RepAndreCarson,CongressmanAndreCarson,repandrecarson,UCprUnnEgM2VUGmAKSaZXCSw,C001072,CongressmanAndreCarson,4264027480282996,America must use its influence to protect the rights of Palestinians and work toward a lasting peace.,America must use its influence to protect the rights of Palestinians and work toward a lasting peace.,,2021-05-13 21:02:19.000000,,https://video-iad3-2.xx.fbcdn.net/v/t42.1790-2/186173547_524844732222870_1108148155554277923_n.mp4?_nc_cat=104&ccb=1-3&_nc_sid=985c63&efg=eyJ2ZW5jb2RlX3RhZyI6InN2ZV9zZCJ9&_nc_ohc=np-W0xfhka8AX9HrRND&_nc_rml=0&_nc_ht=video-iad3-2.xx&oh=25cae6951b5e4be9acc4ded549c2e4ce&oe=609E728F,https://scontent-iad3-2.xx.fbcdn.net/v/t15.5256-10/cp0/e15/q65/s320x320/181713106_307145964315130_5569596162130144090_n.jpg?_nc_cat=111&ccb=1-3&_nc_sid=ccf8b3&_nc_ohc=EHj1aZsBQGoAX9ah_-t&_nc_ht=scontent-iad3-2.xx&tp=9&oh=909a123d15717243caf81e65d38472b1&oe=60C4C66A,307144730981920,111,21,0,https://facebook.com/CongressmanAndreCarson/videos/307144730981920,,123884330964019,Congressman André Carson,False,[]
326,244,Tom O’Halleran,M,rep,AZ,1,,Democrat,https://ohalleran.house.gov,repohalleran,repohalleran,,,O000171,repohalleran,5419598278112806,"ICYMI: Billions of dollars in emergency funding I helped to secure under the American Rescue Plan will soon be headed to our long-overlooked state, local, and tribal governments! Learn more: https://bit.ly/3o5UmNl

OHALLERAN.HOUSE.GOV
Treasury Finalizes ARP Funding Allocations for many Arizona Towns, Announces O’Halleran","ICYMI: Billions of dollars in emergency funding I helped to secure under the American Rescue Plan will soon be headed to our long-overlooked state, local, and tribal governments! Learn more: https://bit.ly/3o5UmNl","OHALLERAN.HOUSE.GOV
Treasury Finalizes ARP Funding Allocations for many Arizona Towns, Announces O’Halleran",2021-05-13 21:00:34.000000,,,,,16,1,0,https://facebook.com/repohalleran/posts/5419598278112806,https://bit.ly/3o5UmNl,1342596452479696,Rep. Tom O'Halleran,False,[]
349,260,Brian J. Mast,M,rep,FL,18,,Republican,https://mast.house.gov,repbrianmast,repbrianmast,repbrianmast,,M001199,repbrianmast,2954614671485966,"We cannot pretend that Hamas is anything other than a radical Islamic terrorist organization.

BREITBART.COM
Brian Mast Blasts Radical Ilhan Omar for Accusing Israel of Terrorism",We cannot pretend that Hamas is anything other than a radical Islamic terrorist organization.,"BREITBART.COM
Brian Mast Blasts Radical Ilhan Omar for Accusing Israel of Terrorism",2021-05-13 20:55:08.000000,,,,,300,29,29,https://facebook.com/repbrianmast/posts/2954614671485966,https://www.breitbart.com/politics/2021/05/13/republican-brian-mast-blasts-radical-democrat-ilhan-omar-for-accusing-our-ally-israel-of-terrorism/,1840872046193573,Congressman Brian Mast,False,[]
254,211,Norma J. Torres,F,rep,CA,35,,Democrat,https://torres.house.gov,NormaJTorres,RepNormaTorres,,UCvWY4qKP6--o3pIJY7hhKDg,T000474,RepNormaTorres,4274174225940803,I'm cosponsoring the #IamVanessaGuillen Act because sexual violence survivors in the military have waited far too long for real justice. We honor Vanessa Guillen's life by sending a clear message that sexual assault and harassment will not be tolerated in our armed forces.,I'm cosponsoring the #IamVanessaGuillen Act because sexual violence survivors in the military have waited far too long for real justice. We honor Vanessa Guillen's life by sending a clear message that sexual assault and harassment will not be tolerated in our armed forces.,,2021-05-13 20:50:37.000000,https://scontent-iad3-2.xx.fbcdn.net/v/t1.6435-9/fr/cp0/e15/q65/185585700_4274173852607507_5603437328036211685_n.jpg?_nc_cat=111&ccb=1-3&_nc_sid=8024bb&_nc_ohc=pqcbG8NzdfoAX-1QlME&_nc_ht=scontent-iad3-2.xx&tp=14&oh=8e914bdb4aa85efeeba6e789cb74b8d2&oe=60C5B161,,,,70,2,0,https://facebook.com/RepNormaTorres/posts/4274174225940803,,324545627570369,Congresswoman Norma Torres,False,['https://scontent-iad3-2.xx.fbcdn.net/v/t1.6435-9/fr/cp0/e15/q65/185585700_4274173852607507_5603437328036211685_n.jpg?_nc_cat=111&ccb=1-3&_nc_sid=8024bb&_nc_ohc=pqcbG8NzdfoAX-1QlME&_nc_ht=scontent-iad3-2.xx&tp=14&oh=8e914bdb4aa85efeeba6e789cb74b8d2&oe=60C5B161']
144,103,Nancy Pelosi,F,rep,CA,12,,Democrat,https://pelosi.house.gov,SpeakerPelosi,NancyPelosi,nancypelosi,UCxPeEcH0xaCK9nBK98EFhDg,P000197,NancyPelosi,10159947912889384,The January 6 insurrection was not a “normal tourist visit.” That’s beyond denial. It falls into the range of sick.,The January 6 insurrection was not a “normal tourist visit.” That’s beyond denial. It falls into the range of sick.,,2021-05-13 20:43:13.000000,,https://video-iad3-2.xx.fbcdn.net/v/t42.1790-2/183975494_557314205515621_256396960135760889_n.mp4?_nc_cat=105&ccb=1-3&_nc_sid=985c63&efg=eyJ2ZW5jb2RlX3RhZyI6InN2ZV9zZCJ9&_nc_ohc=jlqS65dSlhMAX9JPpmz&_nc_rml=0&_nc_ht=video-iad3-2.xx&oh=2bcdc0331955a0130d85bcc199c7e077&oe=609E7841,https://scontent-iad3-2.xx.fbcdn.net/v/t15.5256-10/cp0/e15/q65/p320x320/182336834_365422058400197_8300177739256026808_n.jpg?_nc_cat=105&ccb=1-3&_nc_sid=ccf8b3&_nc_ohc=_T6N6QkTBFAAX99bhx-&_nc_ht=scontent-iad3-2.xx&tp=3&oh=2f8eb7ebdd2025bb9a25f09f7b1f7c4e&oe=60C20CE6,365421368400266,3896,625,0,https://facebook.com/NancyPelosi/videos/365421368400266,,86574174383,House Speaker Nancy Pelosi,False,[]
101,74,John B. Larson,M,rep,CT,1,,Democrat,https://larson.house.gov,RepJohnLarson,RepJohnLarson,RepJohnLarson,UCGPsvFF-9WfpdRSCcCrPLiQ,L000557,RepJohnLarson,10159083748538632,"The CDC now says if you are fully vaccinated you do not need to wear a mask indoors or outdoors in most cases. Connecticut is lifting the mask mandate indoors for vaccinated people on May 19th. You can learn more here: https://www.washingtonpost.com/health/2021/05/13/cdc-says-fully-vaccinated-americans-no-longer-need-masks-indoors-or-outdoors-most-cases/

If you aren't vaccinated, schedule an appointment or go to a walk up clinic today! Find a clinic near you: https://portal.ct.gov/Vaccine-Portal

PORTAL.CT.GOV
Connecticut COVID-19 Vaccine Portal","The CDC now says if you are fully vaccinated you do not need to wear a mask indoors or outdoors in most cases. Connecticut is lifting the mask mandate indoors for vaccinated people on May 19th. You can learn more here: https://www.washingtonpost.com/health/2021/05/13/cdc-says-fully-vaccinated-americans-no-longer-need-masks-indoors-or-outdoors-most-cases/

If you aren't vaccinated, schedule an appointment or go to a walk up clinic today! Find a clinic near you: https://portal.ct.gov/Vaccine-Portal","PORTAL.CT.GOV
Connecticut COVID-19 Vaccine Portal",2021-05-13 20:31:14.000000,,,,,2,0,0,https://facebook.com/RepJohnLarson/posts/10159083748538632,https://www.washingtonpost.com/health/2021/05/13/cdc-says-fully-vaccinated-americans-no-longer-need-masks-indoors-or-outdoors-most-cases/,6352928631,John Larson,False,[]
202,188,Scott Perry,M,rep,PA,10,,Republican,https://perry.house.gov,RepScottPerry,repscottperry,RepScottPerry,UCzgrU5PT_HHRgf5hXPen4dQ,P000605,repscottperry,4124443414318582,Simple solution: Stop paying people to stay home. #BIDENSAMERICA,Simple solution: Stop paying people to stay home. #BIDENSAMERICA,,2021-05-13 20:28:33.000000,https://scontent-iad3-2.xx.fbcdn.net/v/t1.6435-9/fr/cp0/e15/q65/186489760_4124441637652093_2149410563533683349_n.jpg?_nc_cat=101&ccb=1-3&_nc_sid=110474&_nc_ohc=U7NhHR-qksMAX83F9ws&_nc_ht=scontent-iad3-2.xx&tp=14&oh=efa19371dc12beed86c33d6d6ca63419&oe=60C477BF,,,,574,82,0,https://facebook.com/repscottperry/posts/4124443414318582,,376801102416184,Rep. Scott Perry,False,['https://scontent-iad3-2.xx.fbcdn.net/v/t1.6435-9/fr/cp0/e15/q65/186489760_4124441637652093_2149410563533683349_n.jpg?_nc_cat=101&ccb=1-3&_nc_sid=110474&_nc_ohc=U7NhHR-qksMAX83F9ws&_nc_ht=scontent-iad3-2.xx&tp=14&oh=efa19371dc12beed86c33d6d6ca63419&oe=60C477BF']
313,237,Aumua Amata Coleman Radewagen,F,rep,AS,0,,Republican,https://radewagen.house.gov,RepAmata,aumuaamata,,UCGdrLQbt1PYDTPsampx4t1A,R000600,aumuaamata,2980314265591470,"https://radewagen.house.gov/media-center/press-releases/lt-governor-insists-american-samoa-s-self-determination-must-be

RADEWAGEN.HOUSE.GOV
Lt Governor Insists American Samoa’s Self Determination Must Be Preserved",https://radewagen.house.gov/media-center/press-releases/lt-governor-insists-american-samoa-s-self-determination-must-be,"RADEWAGEN.HOUSE.GOV
Lt Governor Insists American Samoa’s Self Determination Must Be Preserved",2021-05-13 20:21:24.000000,,,,,16,2,3,https://facebook.com/aumuaamata/posts/2980314265591470,https://radewagen.house.gov/media-center/press-releases/lt-governor-insists-american-samoa-s-self-determination-must-be,1537155909907320,Congresswoman Aumua Amata,False,[]
228,198,Mark Pocan,M,rep,WI,2,,Democrat,https://pocan.house.gov,RepMarkPocan,repmarkpocan,repmarkpocan,UCz5b47WER_u3dUGV_Zi70dQ,P000607,repmarkpocan,4046576152088761,"Today, my colleagues and I stood up because no one should suffer the loss of life, liberty, or dignity that the Palestinian people have suffered.

If you are neutral in situations of injustice, you have chosen the side of the oppressor.","Today, my colleagues and I stood up because no one should suffer the loss of life, liberty, or dignity that the Palestinian people have suffered.

If you are neutral in situations of injustice, you have chosen the side of the oppressor.",,2021-05-13 20:15:49.000000,,https://video-iad3-2.xx.fbcdn.net/v/t42.1790-2/186203828_5530474157024217_2816416233745396797_n.mp4?_nc_cat=101&ccb=1-3&_nc_sid=985c63&efg=eyJ2ZW5jb2RlX3RhZyI6InN2ZV9zZCJ9&_nc_ohc=aPfvxAejUVQAX8nUtRs&_nc_rml=0&_nc_ht=video-iad3-2.xx&oh=8177ff246c376c1c5c916b4fdecdba15&oe=609E7729,https://scontent-iad3-2.xx.fbcdn.net/v/t15.5256-10/cp0/e15/q65/s320x320/184293055_523921421969782_3450535578672603054_n.jpg?_nc_cat=103&ccb=1-3&_nc_sid=ccf8b3&_nc_ohc=3NDM6vZ1wtAAX_dZen4&_nc_ht=scontent-iad3-2.xx&tp=9&oh=93d9dd2e8d47303fafde54586123cbc6&oe=60C3F7DE,523920438636547,148,29,0,https://facebook.com/repmarkpocan/videos/523920438636547,,436881033058309,Mark Pocan,False,[]
138,102,"Bill Pascrell, Jr.",M,rep,NJ,9,,Democrat,https://pascrell.house.gov,BillPascrell,pascrell,RepPascrell,UCIy1Ru8oA14aRjpq6L3i-EQ,P000096,pascrell,10159013028039156,127 days ago terrorists ransacked the US Capitol and *hours later* 138-of-202 (68%) House republicans voted to make trump a dictator. They tried to finish the rioters’ job and end democracy. Never forget it.,127 days ago terrorists ransacked the US Capitol and *hours later* 138-of-202 (68%) House republicans voted to make trump a dictator. They tried to finish the rioters’ job and end democracy. Never forget it.,,2021-05-13 20:12:27.000000,,,,,144,29,0,https://facebook.com/pascrell/posts/10159013028039156,,303312929155,"Congressman Bill Pascrell, Jr.",False,[]
293,231,Brian Babin,M,rep,TX,36,,Republican,https://babin.house.gov,RepBrianBabin,RepBrianBabin,,UCPVEZgw-VbDRbLV1MRGVQNQ,B001291,RepBrianBabin,1714503252054984,"We deserve to know the truth behind the origins of #COVID19.

If Communist China is responsible for leaking this virus - that's killed more than 3 million people worldwide - they should be held accountable.

Biden should declassify the intelligence related to this leak NOW!

FOXNEWS.COM
Rep. Gallagher bill would force Biden to declassify Wuhan coronavirus lab leak theory intel","We deserve to know the truth behind the origins of #COVID19.

If Communist China is responsible for leaking this virus - that's killed more than 3 million people worldwide - they should be held accountable.

Biden should declassify the intelligence related to this leak NOW!","FOXNEWS.COM
Rep. Gallagher bill would force Biden to declassify Wuhan coronavirus lab leak theory intel",2021-05-13 20:06:11.000000,,,,,224,7,16,https://facebook.com/RepBrianBabin/posts/1714503252054984,https://www.foxnews.com/politics/gallagher-bill-covid-lab-leak-china-wuhan-institute-virology,355799157925407,Rep. Brian Babin,False,[]
