,name,chamber,party,state,district,date,content,replyCount,retweetCount,likeCount,quoteCount,handle,platform,url,photos,news,text,toke,topic,enga,engaSum
303,Billy Long,House,Republican,MO,7,2021-05-20 15:03:19.000000,"5G will be critical to our nation's economy, national security and help close the digital divide. Congress needs to support the buildout of #5G networks by supporting policies that will embolden innovators and remove barriers to investing in cutting edge broadband infrastructure.

The American Broadband Act will put our nation on track to win the the race to 5G.

REPUBLICANLEADER.GOV
Rep. Long: The American Broadband Act Will Ensure America Wins the 5G Race - House Republican Leader",13,0,13,0,Rep.Billy.Long,Facebook,https://facebook.com/Rep.Billy.Long/posts/3820479804686775,,https://www.republicanleader.gov/rep-long-the-american-broadband-act-will-ensure-america-wins-the-5g-race/,5g critical nations economy national security help close digital divide congress needs support buildout 5g networks supporting policies embolden innovators remove barriers investing cutting edge broadband infrastructurethe american broadband act put nation track win race 5grepublicanleadergovrep long american broadband act ensure america wins 5g race house republican leader,"['5g', 'critical', 'nations', 'economy', 'national', 'security', 'help', 'close', 'digital', 'divide', 'congress', 'needs', 'support', 'buildout', '5g', 'networks', 'supporting', 'policies', 'embolden', 'innovators', 'remove', 'barriers', 'investing', 'cutting', 'edge', 'broadband', 'infrastructurethe', 'american', 'broadband', 'act', 'put', 'nation', 'track', 'win', 'race', '5grepublicanleadergovrep', 'long', 'american', 'broadband', 'act', 'ensure', 'america', 'wins', '5g', 'race', 'house', 'republican', 'leader']",27,26,19967
315,Gus M. Bilirakis,House,Republican,FL,12,2021-05-20 14:29:05.000000,"Earlier today, I re-introduced the Lonnie Kilpatrick Central Pacific Relief Act, which provides a presumption for service-connection for diseases associated with herbicides such as Agent Orange for Vietnam-era Veterans who served in Guam and American Samoa. This bill hits close to home, as Mr. Kilpatrick was a Veteran from our district who served in Guam and sadly passed away as a result of his diseases, which the VA ultimately recognized was connected to his service. It was an honor to be joined by his widow, Sheila, as we reintroduced the legislation. I will never stop fighting until heroes, like Lonnie, get the care and benefits they deserve. A special thanks to my colleague, Congressman Michael San Nicolas, for co-authoring this important bill with me. We will work together to get this done for these Veterans.",2,0,23,0,GusBilirakis,Facebook,https://facebook.com/GusBilirakis/posts/4574188905944561,https://scontent-iad3-2.xx.fbcdn.net/v/t1.6435-9/fr/cp0/e15/q65/188534883_4574181149278670_3925647948548105549_n.jpg?_nc_cat=109&ccb=1-3&_nc_sid=8024bb&_nc_ohc=ypsDmaAEyo0AX8r_noz&_nc_ht=scontent-iad3-2.xx&tp=14&oh=02488856954e68522d4ab48229a77ad2&oe=60CE3D00,,earlier today reintroduced lonnie kilpatrick central pacific relief act provides presumption serviceconnection diseases associated herbicides agent orange vietnamera veterans served guam american samoa bill hits close home mr kilpatrick veteran district served guam sadly passed away result diseases va ultimately recognized connected service honor joined widow sheila reintroduced legislation never stop fighting heroes like lonnie get care benefits deserve special thanks colleague congressman michael san nicolas coauthoring important bill work together get done veterans,"['earlier', 'today', 'reintroduced', 'lonnie', 'kilpatrick', 'central', 'pacific', 'relief', 'act', 'provides', 'presumption', 'serviceconnection', 'diseases', 'associated', 'herbicides', 'agent', 'orange', 'vietnamera', 'veterans', 'served', 'guam', 'american', 'samoa', 'bill', 'hits', 'close', 'home', 'mr', 'kilpatrick', 'veteran', 'district', 'served', 'guam', 'sadly', 'passed', 'away', 'result', 'diseases', 'va', 'ultimately', 'recognized', 'connected', 'service', 'honor', 'joined', 'widow', 'sheila', 'reintroduced', 'legislation', 'never', 'stop', 'fighting', 'heroes', 'like', 'lonnie', 'get', 'care', 'benefits', 'deserve', 'special', 'thanks', 'colleague', 'congressman', 'michael', 'san', 'nicolas', 'coauthoring', 'important', 'bill', 'work', 'together', 'get', 'done', 'veterans']",23,25,667
139,Margaret Wood Hassan,Senate,Democrat,NH,,2021-05-20 16:41:12.000000,"Whistleblowers should never be silenced. At yesterday’s Veterans’ Affairs Committee hearing, I talked about the importance of taking whistleblower allegations seriously like those made at White River Junction VA Medical Center. Watch now:",4,0,21,0,SenatorHassan,Facebook,https://facebook.com/SenatorHassan/videos/904762746971113,,,whistleblowers never silenced yesterdays veterans affairs committee hearing talked importance taking whistleblower allegations seriously like made white river junction va medical center watch,"['whistleblowers', 'never', 'silenced', 'yesterdays', 'veterans', 'affairs', 'committee', 'hearing', 'talked', 'importance', 'taking', 'whistleblower', 'allegations', 'seriously', 'like', 'made', 'white', 'river', 'junction', 'va', 'medical', 'center', 'watch']",23,25,667
85,Brian K. Fitzpatrick,House,Republican,PA,1,2021-05-20 13:01:11+00:00,Congrats to the @BensalemSchools Marine Corps JROTC Cadets who celebrated their hard work &amp; perseverance throughout this past year at the Annual Awards &amp; Change of Command Ceremony. This impressive group of young men &amp; women have already made an impact on our community &amp; country. https://t.co/iFvH9p1b7A,13,1,11,0,repbrianfitz,Twitter,https://twitter.com/RepBrianFitz/status/1395363977295716353,https://pbs.twimg.com/media/E11UJA6XIAEZyeF?format=jpg&name=small,[],congrats marine corps jrotc cadets celebrated hard work perseverance throughout past year annual awards change command ceremony impressive group young men women already made impact community country,"['congrats', 'marine', 'corps', 'jrotc', 'cadets', 'celebrated', 'hard', 'work', 'perseverance', 'throughout', 'past', 'year', 'annual', 'awards', 'change', 'command', 'ceremony', 'impressive', 'group', 'young', 'men', 'women', 'already', 'made', 'impact', 'community', 'country']",16,25,2249
48,David J. Trone,House,Democrat,MD,6,2021-05-20 19:31:14+00:00,"Today on #MentalHealthAction Day, I'm wearing lime green to raise awareness about mental health issues. Let's stop the stigma surrounding mental health and continue to ensure resources are available to all members of our community. https://t.co/cFEY78TRUT",1,4,19,0,repdavidtrone,Twitter,https://twitter.com/RepDavidTrone/status/1395462138676879363,https://pbs.twimg.com/media/E12taoyXoAM04ko?format=jpg&name=small,[],today mentalhealthaction day im wearing lime green raise awareness mental health issues lets stop stigma surrounding mental health continue ensure resources available members community,"['today', 'mentalhealthaction', 'day', 'im', 'wearing', 'lime', 'green', 'raise', 'awareness', 'mental', 'health', 'issues', 'lets', 'stop', 'stigma', 'surrounding', 'mental', 'health', 'continue', 'ensure', 'resources', 'available', 'members', 'community']",24,24,8411
284,Kurt Schrader,House,Democrat,OR,5,2021-05-20 16:17:27.000000,"By implementing consistent policy around proactive fuel treatment measures like prescribed burns, the National Prescribed Fire Act will help us begin to tackle the current hazardous fuels backlog to reduce the number and severity of wildfires.

SCHRADER.HOUSE.GOV
Reps. Schrader, Schrier, Simpson Introduce Bipartisan Bill to Mitigate Wildfires & Protect Forests",1,3,20,0,repschrader,Facebook,https://facebook.com/repschrader/posts/10157915275076696,,https://schrader.house.gov/newsroom/documentsingle.aspx?DocumentID=392929,implementing consistent policy around proactive fuel treatment measures like prescribed burns national prescribed fire act help us begin tackle current hazardous fuels backlog reduce number severity wildfiresschraderhousegovreps schrader schrier simpson introduce bipartisan bill mitigate wildfires protect forests,"['implementing', 'consistent', 'policy', 'around', 'proactive', 'fuel', 'treatment', 'measures', 'like', 'prescribed', 'burns', 'national', 'prescribed', 'fire', 'act', 'help', 'us', 'begin', 'tackle', 'current', 'hazardous', 'fuels', 'backlog', 'reduce', 'number', 'severity', 'wildfiresschraderhousegovreps', 'schrader', 'schrier', 'simpson', 'introduce', 'bipartisan', 'bill', 'mitigate', 'wildfires', 'protect', 'forests']",26,24,959
419,Senate Committee on Energy and Natural Resources,Senate,N/A,N/A,N/A,2021-05-20 20:12:49+00:00,"RM @SenJohnBarrasso on @POTUS gifting Russia Nord Stream 2 &amp; killing Keystone: “After these 2 clumsy &amp; costly episodes in U.S. energy diplomacy, it's reasonable to ask why @POTUS seems more intent on saving Russian jobs than American jobs” @NewsweekOpinion newsweek.com/tale-two-pipel…",10,6,8,0,energygop,Twitter,https://twitter.com/EnergyGOP/status/1395472601569501187,,['https://www.newsweek.com/tale-two-pipelines-opinion-1576593'],rm gifting russia nord stream killing keystone clumsy costly episodes us energy diplomacy reasonable ask seems intent saving russian jobs american jobs newsweekcomtaletwopipel,"['rm', 'gifting', 'russia', 'nord', 'stream', 'killing', 'keystone', 'clumsy', 'costly', 'episodes', 'us', 'energy', 'diplomacy', 'reasonable', 'ask', 'seems', 'intent', 'saving', 'russian', 'jobs', 'american', 'jobs', 'newsweekcomtaletwopipel']",13,24,3012
435,House Committee on Transportation and Infrastructure,House,N/A,N/A,N/A,2021-05-20 16:03:18+00:00,Forty Members of Congress from both parties are demonstrating their commitment to #CleanWater by co-sponsoring the Water Quality Protection and Job Creation Act. It will provide $50B to help communities improve wastewater infrastructure and create jobs. See who co-sponsored⬇️ https://t.co/xDb52Vij10,2,6,15,1,transportdems,Twitter,https://twitter.com/TransportDems/status/1395409807574712326,https://pbs.twimg.com/media/E119ujAXsAMghqr?format=jpg&name=small,[],forty members congress parties demonstrating commitment cleanwater cosponsoring water quality protection job creation act provide 50b help communities improve wastewater infrastructure create jobs see cosponsored,"['forty', 'members', 'congress', 'parties', 'demonstrating', 'commitment', 'cleanwater', 'cosponsoring', 'water', 'quality', 'protection', 'job', 'creation', 'act', 'provide', '50b', 'help', 'communities', 'improve', 'wastewater', 'infrastructure', 'create', 'jobs', 'see', 'cosponsored']",10,24,25575
368,Brian Higgins,House,Democrat,NY,26,2021-05-20 10:13:38.000000,no text,0,0,23,0,RepBrianHiggins,Facebook,https://facebook.com/RepBrianHiggins/posts/10157845116091441,,https://www.wgrz.com/article/news/health/coronavirus/brian-higgins-asks-new-york-state-to-make-covid-vaccines-available-to-canadians/71-086212fc-9227-491c-b5d2-25fb992dbb4d,text,['text'],10,23,25575
417,House Committee on Energy and Commerce,House,N/A,N/A,N/A,2021-05-20 20:26:52+00:00,"After just one week, over 1 million families have enrolled in the Emergency Broadband Benefit program, marking a milestone in our mission to close the #DigitalDivide! This program is proving to be significant for those struggling to afford internet service. twitter.com/FCC/status/139…",0,6,17,0,energycommerce,Twitter,https://twitter.com/EnergyCommerce/status/1395476137044762627,,['https://twitter.com/FCC/status/1395380973395746823'],one week million families enrolled emergency broadband benefit program marking milestone mission close digitaldivide program proving significant struggling afford internet service twittercomfccstatus139,"['one', 'week', 'million', 'families', 'enrolled', 'emergency', 'broadband', 'benefit', 'program', 'marking', 'milestone', 'mission', 'close', 'digitaldivide', 'program', 'proving', 'significant', 'struggling', 'afford', 'internet', 'service', 'twittercomfccstatus139']",04,23,511
60,David Kustoff,House,Republican,TN,8,2021-05-20 17:52:59+00:00,I joined @RepMcCaul in sending a letter to @JoeBiden  supporting #Israel’s right to self-defense. We must ensure the U.S. maintains the security assistance Israel needs to defend herself from Hamas and other terrorist organizations. Read the letter here: gop-foreignaffairs.house.gov/wp-content/upl…,4,6,12,1,repdavidkustoff,Twitter,https://twitter.com/RepDavidKustoff/status/1395437410767544321,,['https://gop-foreignaffairs.house.gov/wp-content/uploads/2021/05/5.19.21-MTM-Et-Al-Letter-to-Biden-re-Israel.pdf'],joined sending letter supporting israels right selfdefense must ensure us maintains security assistance israel needs defend hamas terrorist organizations read letter gopforeignaffairshousegovwpcontentupl,"['joined', 'sending', 'letter', 'supporting', 'israels', 'right', 'selfdefense', 'must', 'ensure', 'us', 'maintains', 'security', 'assistance', 'israel', 'needs', 'defend', 'hamas', 'terrorist', 'organizations', 'read', 'letter', 'gopforeignaffairshousegovwpcontentupl']",18,23,126933
329,Zoe Lofgren,House,Democrat,CA,19,2021-05-20 13:44:08.000000,"As we celebrate Asian/Pacific American Heritage Month, I’m deeply grateful for the many contributions generations of AAPI Americans have made to our South Bay communities & the country.

I also stand in solidarity with AAPI communities against the surge in discrimination & violence throughout the past year. This week, the House passed the COVID-19 Hate Crimes Act & condemned the horrific acts of gun violence in Georgia.

Our message is clear: we will not tolerate hate & discrimination.",0,0,23,0,zoelofgren,Facebook,https://facebook.com/zoelofgren/posts/10165310526990720,https://scontent-iad3-2.xx.fbcdn.net/v/t1.6435-9/188715073_10165310525905720_539147503386768035_n.png?_nc_cat=109&ccb=1-3&_nc_sid=8024bb&_nc_ohc=hPbDFsigFW4AX9REQ8k&_nc_ht=scontent-iad3-2.xx&oh=bc13e9c577db6ebdb820fc1f5e42e23c&oe=60CC8E6C,,celebrate asianpacific american heritage month im deeply grateful many contributions generations aapi americans made south bay communities countryi also stand solidarity aapi communities surge discrimination violence throughout past year week house passed covid19 hate crimes act condemned horrific acts gun violence georgiaour message clear tolerate hate discrimination,"['celebrate', 'asianpacific', 'american', 'heritage', 'month', 'im', 'deeply', 'grateful', 'many', 'contributions', 'generations', 'aapi', 'americans', 'made', 'south', 'bay', 'communities', 'countryi', 'also', 'stand', 'solidarity', 'aapi', 'communities', 'surge', 'discrimination', 'violence', 'throughout', 'past', 'year', 'week', 'house', 'passed', 'covid19', 'hate', 'crimes', 'act', 'condemned', 'horrific', 'acts', 'gun', 'violence', 'georgiaour', 'message', 'clear', 'tolerate', 'hate', 'discrimination']",17,23,12360
82,Bradley Scott Schneider,House,Democrat,IL,10,2021-05-20 15:01:44+00:00,"Once again, Tucker Carlson plumbs the depths with white supremacist and racist language in attacking Lori Lightfoot. His casual attack disrespects the millions murdered by Nazis. He should learn my rule: Unless talking about Nazis, don't talk about Nazis. mediamatters.org/tucker-carlson…",4,3,16,0,repschneider,Twitter,https://twitter.com/RepSchneider/status/1395394313354371073,,['https://www.mediamatters.org/tucker-carlson/tucker-carlson-compares-lori-lightfoot-nazis-and-warns-she-will-target-white-people'],tucker carlson plumbs depths white supremacist racist language attacking lori lightfoot casual attack disrespects millions murdered nazis learn rule unless talking nazis dont talk nazis mediamattersorgtuckercarlson,"['tucker', 'carlson', 'plumbs', 'depths', 'white', 'supremacist', 'racist', 'language', 'attacking', 'lori', 'lightfoot', 'casual', 'attack', 'disrespects', 'millions', 'murdered', 'nazis', 'learn', 'rule', 'unless', 'talking', 'nazis', 'dont', 'talk', 'nazis', 'mediamattersorgtuckercarlson']",15,23,1648
43,Mike Garcia,House,Republican,CA,25,2021-05-20 19:46:38+00:00,It was great to join fellow Californian @RepCarbajal and a bipartisan group of my veteran colleagues to assemble care packages for our servicemembers overseas. #supportourtroops #MilitaryAppreciationMonth https://t.co/Hw1TUJplm5,10,2,9,1,repmikegarcia,Twitter,https://twitter.com/RepMikeGarcia/status/1395466011382587398,https://pbs.twimg.com/ext_tw_video_thumb/1395465657551048707/pu/img/mEHhF_AkgFWEcZlk.jpg,[],great join fellow californian bipartisan group veteran colleagues assemble care packages servicemembers overseas supportourtroops militaryappreciationmonth,"['great', 'join', 'fellow', 'californian', 'bipartisan', 'group', 'veteran', 'colleagues', 'assemble', 'care', 'packages', 'servicemembers', 'overseas', 'supportourtroops', 'militaryappreciationmonth']",19,22,534
334,Jim Cooper,House,Democrat,TN,5,2021-05-20 13:04:28.000000,"On #MentalHealthAction Day, we join together to break through stigma, express compassion for those who struggle with mental health issues and draw attention to the proven methods that can help change their lives for the better.",0,0,22,0,JimCooper,Facebook,https://facebook.com/JimCooper/posts/10159407213536392,https://scontent-iad3-2.xx.fbcdn.net/v/t1.6435-9/fr/cp0/e15/q65/188798248_10159407213356392_9188499178899968557_n.jpg?_nc_cat=111&ccb=1-3&_nc_sid=8024bb&_nc_ohc=VURMeXSdT9wAX-0fbaO&_nc_ht=scontent-iad3-2.xx&tp=14&oh=2e6cecb9d52efcf0cf3a208e4300e7d6&oe=60CC2E32,,mentalhealthaction day join together break stigma express compassion struggle mental health issues draw attention proven methods help change lives better,"['mentalhealthaction', 'day', 'join', 'together', 'break', 'stigma', 'express', 'compassion', 'struggle', 'mental', 'health', 'issues', 'draw', 'attention', 'proven', 'methods', 'help', 'change', 'lives', 'better']",24,22,8411
41,Don Bacon,House,Republican,NE,2,2021-05-20 20:01:03+00:00,"Rural broadband is desperately needed in both the farmhouse and in the field.

Through the Broadband for Rural America Act, @HouseAgGOP is paving a path forward that will #EndTheDigitalDivide.",9,3,10,0,repdonbacon,Twitter,https://twitter.com/RepDonBacon/status/1395469639363203082,,[],rural broadband desperately needed farmhouse fieldthrough broadband rural america act paving path forward endthedigitaldivide,"['rural', 'broadband', 'desperately', 'needed', 'farmhouse', 'fieldthrough', 'broadband', 'rural', 'america', 'act', 'paving', 'path', 'forward', 'endthedigitaldivide']",27,22,19967
121,James E. Risch,Senate,Republican,ID,,2021-05-20 18:00:41.000000,"This pandemic has underscored for everyone how important small businesses are to the culture and fabric of our society here in Idaho.

I encourage everyone to join me on May 21st to #SupportLocalGems. Will you be joining me?",4,0,16,0,senatorjimrisch,Facebook,https://facebook.com/senatorjimrisch/videos/373764010719513,,,pandemic underscored everyone important small businesses culture fabric society idahoi encourage everyone join may 21st supportlocalgems joining,"['pandemic', 'underscored', 'everyone', 'important', 'small', 'businesses', 'culture', 'fabric', 'society', 'idahoi', 'encourage', 'everyone', 'join', 'may', '21st', 'supportlocalgems', 'joining']",24,20,8411
126,John Boozman,Senate,Republican,AR,,2021-05-20 17:47:17.000000,"The Veterans History Project is a worthwhile endeavor. I’m proud of the work my office has done to grow it in Arkansas. Get involved today and help preserve the memories and experiences of our nation’s heroes.

Library of Congress Veterans History Project
Yesterday at 12:55 AM ·

Wondering what to do this Memorial Day?

Consider honoring our county's fallen by interviewing a Gold Star Family Member about their loved one's service and sacrifice. Email vohp@loc.gov to learn how you can preserve their legacy at our national Library.",1,0,19,0,JohnBoozman,Facebook,https://facebook.com/JohnBoozman/posts/10158033038985736,https://scontent-iad3-2.xx.fbcdn.net/v/t1.6435-9/186484371_3990877230978433_7228839929749622177_n.png?_nc_cat=110&ccb=1-3&_nc_sid=8024bb&_nc_ohc=711XXh7p4YUAX_WmFJ9&_nc_ht=scontent-iad3-2.xx&oh=be790ac00138a4018e900d30482c2d41&oe=60CBAE62,,veterans history project worthwhile endeavor im proud work office done grow arkansas get involved today help preserve memories experiences nations heroeslibrary congress veterans history projectyesterday wondering memorial dayconsider honoring countys fallen interviewing gold star family member loved ones service sacrifice email vohpgov learn preserve legacy national library,"['veterans', 'history', 'project', 'worthwhile', 'endeavor', 'im', 'proud', 'work', 'office', 'done', 'grow', 'arkansas', 'get', 'involved', 'today', 'help', 'preserve', 'memories', 'experiences', 'nations', 'heroeslibrary', 'congress', 'veterans', 'history', 'projectyesterday', 'wondering', 'memorial', 'dayconsider', 'honoring', 'countys', 'fallen', 'interviewing', 'gold', 'star', 'family', 'member', 'loved', 'ones', 'service', 'sacrifice', 'email', 'vohpgov', 'learn', 'preserve', 'legacy', 'national', 'library']",23,20,667
207,Margaret Wood Hassan,Senate,Democrat,NH,,2021-05-20 11:47:06.000000,"Too many communities across our state still don’t have access to broadband. We need to make serious investments in our broadband infrastructure to allow businesses to thrive in rural areas across New Hampshire.

NYTIMES.COM
Rural Areas Are Looking for Workers. They Need Broadband to Get Them.",2,0,18,0,SenatorHassan,Facebook,https://facebook.com/SenatorHassan/posts/4409675475711891,,https://www.nytimes.com/2021/05/17/business/infrastructure-rural-broadband.html?smtyp=cur&smid=tw-nytimes,many communities across state still dont access broadband need make serious investments broadband infrastructure allow businesses thrive rural areas across new hampshirenytimescomrural areas looking workers need broadband get,"['many', 'communities', 'across', 'state', 'still', 'dont', 'access', 'broadband', 'need', 'make', 'serious', 'investments', 'broadband', 'infrastructure', 'allow', 'businesses', 'thrive', 'rural', 'areas', 'across', 'new', 'hampshirenytimescomrural', 'areas', 'looking', 'workers', 'need', 'broadband', 'get']",04,20,511
110,Martin Heinrich,Senate,Democrat,NM,,2021-05-20 19:00:18.000000,"Internet access has become a basic necessity for families this past year—it's how they access their doctor's appointments, school, and work.

If you’ve lost income in this past year and need assistance paying your internet bill, there’s a new federal program to help.⬇️

FCC.GOV
Emergency Broadband Benefit",1,0,19,0,MartinHeinrich,Facebook,https://facebook.com/MartinHeinrich/posts/10159364480054214,,https://www.fcc.gov/broadbandbenefit,internet access become basic necessity families past yearits access doctors appointments school workif youve lost income past year need assistance paying internet bill theres new federal program helpfccgovemergency broadband benefit,"['internet', 'access', 'become', 'basic', 'necessity', 'families', 'past', 'yearits', 'access', 'doctors', 'appointments', 'school', 'workif', 'youve', 'lost', 'income', 'past', 'year', 'need', 'assistance', 'paying', 'internet', 'bill', 'theres', 'new', 'federal', 'program', 'helpfccgovemergency', 'broadband', 'benefit']",04,20,511
450,House Committee on Transportation and Infrastructure,House,N/A,N/A,N/A,2021-05-20 13:33:29+00:00,"This #NationalMaritimeDay, @TransportDems thank the maritime industry workers who have kept people and goods moving during the pandemic for being an important part of our nation's economic recovery. https://t.co/I4z879IT84",0,1,17,0,transportdems,Twitter,https://twitter.com/TransportDems/status/1395372107966685191,https://pbs.twimg.com/tweet_video_thumb/E11bfSBXMAAVpFQ.jpg,[],nationalmaritimeday thank maritime industry workers kept people goods moving pandemic important part nations economic recovery,"['nationalmaritimeday', 'thank', 'maritime', 'industry', 'workers', 'kept', 'people', 'goods', 'moving', 'pandemic', 'important', 'part', 'nations', 'economic', 'recovery']",13,18,3012
22,Seth Moulton,House,Democrat,MA,6,2021-05-20 22:21:22+00:00,"Everyone knows taking care of your physical health is critical, but taking care of our mental health is just as important. Getting a mental health check up ought to be as routine as getting an annual physical.  (1/2)",3,4,11,0,teammoulton,Twitter,https://twitter.com/teammoulton/status/1395504953901428742,,[],everyone knows taking care physical health critical taking care mental health important getting mental health check ought routine getting annual physical,"['everyone', 'knows', 'taking', 'care', 'physical', 'health', 'critical', 'taking', 'care', 'mental', 'health', 'important', 'getting', 'mental', 'health', 'check', 'ought', 'routine', 'getting', 'annual', 'physical']",24,18,8411
66,Pete Aguilar,House,Democrat,CA,31,2021-05-20 17:19:55+00:00,"On #MentalHealthAction Day, we join together to combat stigma and express compassion for everyone who struggles. Mental health care is health care, and ending the stigma is the first step toward saving lives. https://t.co/yelJN5udv3",0,6,12,0,reppeteaguilar,Twitter,https://twitter.com/RepPeteAguilar/status/1395429091369705476,https://pbs.twimg.com/media/E12PWQsXMAI-NE5?format=jpg&name=small,[],mentalhealthaction day join together combat stigma express compassion everyone struggles mental health care health care ending stigma first step toward saving lives,"['mentalhealthaction', 'day', 'join', 'together', 'combat', 'stigma', 'express', 'compassion', 'everyone', 'struggles', 'mental', 'health', 'care', 'health', 'care', 'ending', 'stigma', 'first', 'step', 'toward', 'saving', 'lives']",24,18,8411
