,topic,topName,postCount,summary,topEnga,D,R,I
34,c33,33_housing_zoning_greenbrook_landlord,19,"Nancy Pelosi (Democrat-CA) said: Yesterday, I was proud to join HUD @SecFudge, SF Mayor @LondonBreed and @CALtGovernor Eleni Kounalakis at the HOPE SF, Sunnydale Site to promote critical provisions in the #BuildBackBetter Act that tackle housing equity. https://t.co/4Im6in16TD
Charles E. Schumer (Democrat-NY) said: I stood with @BradLander @Bobby4Brooklyn @JoAnneSimonBK52 @JabariBrisport @Zellnor4NY @BrianKavanaghNY to fight back against the predatory practices of Greenbrook Partners, a private equity backed landlord forcing people from their homes across Brooklyn nydailynews.com/news/politics/…
Patty Murray (Democrat-WA) said: Addressing WA state's housing crisis is a top priority for me in the #BuildBackBetter budget. https://t.co/hLKhEHuA6M
Patty Murray (Democrat-WA) said: Today I visited @ChiefSeaClub's Eagle Village housing site to discuss why we need to make strong investments to tackle Washington state's housing and homelessness crisis. This crisis existed even before the pandemic, and simply going back to ""normal"" isn't enough. My #YIMBYAct would require municipalities to cut harmful regulations and improve transparency.",5730,11.0,2.0,0.0
35,c34,34_supportive_mikejohnsonhousegovnewsdocuments_foxnewscompoliticsbook_hinsonhousegovmediapressre,19,"Madison Cawthorn (Republican-NC) said: Unbelievable. foxnews.com/politics/book-…
Ted Cruz (Republican-TX) said: ICYMI: dallasnews.com/news/politics/…
Ilhan Omar (Democrat-MN) said: You can view the full statement here: 

omar.house.gov/media/press-re… https://t.co/gcXcV3mSxe
Raja Krishnamoorthi (Democrat-IL) said: #DemsDeliverJobs
apnews.com/article/corona…
Marsha Blackburn (Republican-TN) said: thedrive.com/the-war-zone/4…
Katherine M. Clark (Democrat-MA) said: Good. bostonglobe.com/2021/10/15/nat…
Maria Cantwell (Democrat-WA) said: cantwell.senate.gov/news/press-rel…
David E. Price (Democrat-NC) said: My Statement on the Passing of Dale Kildee: https://t.co/hoan8pdhGz
Todd Young (Republican-IN) said: It was true then and is still true now. Read the full letter here: young.senate.gov/newsroom/press…
Cathy McMorris Rodgers (Republican-WA) said: Read my full statement here.",2506,8.0,9.0,0.0
36,c35,35_drugs_prescription_medicare_drug,18,"Bernard Sanders (Independent-VT) said: 88% believe we should lower prescription drug costs
84% think we should expand Medicare
73% support establishing Paid Family and Medical Leave
67% want universal Pre-K
 
Here's a radical idea - let's listen to the American people. Kyrsten Sinema (Democrat-AZ) said: We’re joining a bipartisan group of Senators to protect Medicare Advantage for Arizona seniors – ensuring they continue to have affordable access to the health care they need and deserve. I’m fighting to get this done as part of the Build Back Better plan. My bipartisan CARA 3.0 and TREATS Act would expand the drug prevention, treatment, and recovery we need. thehill.com/policy/healthc…
Marie Newman (Democrat-IL) said: FACT: 88% of the American people agree with @POTUS that it's time to lower the price of prescription drugs.",27994,11.0,1.0,1.0
37,c36,36_tax_corporations_pay_taxes,18,"Pramila Jayapal (Democrat-WA) said: How do we Build Back Better? https://t.co/9gQXbe1s5h
Susie Lee (Democrat-NV) said: #BuildBackBetter means making sure the wealthiest &amp; corporations pay their fair share. Middle class families shouldn’t be paying more than wealthy corporations. Alan S. Lowenthal (Democrat-CA) said: The #BuildBackBetter Agenda will provide one of biggest middle class tax cuts in history – paid for by making those at the top pay their fair share.",9275,13.0,2.0,0.0
38,c37,37_families_tax_childtaxcredit_cut,18,"Mazie K. Hirono (Democrat-HI) said: Families across Hawaii and America will receive their fourth #ChildTaxCredit payment TODAY. That's what it means to Build Back Better. It’s time to pass the Build Back Better Act to continue investing in families. https://t.co/CEF3gs2dgy
Robert P. Casey, Jr. (Democrat-PA) said: This month’s #ChildTaxCredit payment is being deposited in millions of families’ bank accounts today, thanks to the American Rescue Plan.",1800,17.0,0.0,0.0
39,c38,38_american_president_antiamerican_adversaries,18,"John Cornyn (Republican-TX) said: After waging war on the oil industry, President Biden suddenly wants its help to reduce gas prices. wsj.com/articles/joe-b… via @WSJOpinion
John Cornyn (Republican-TX) said: The ‘Renewable’ Fallacy and Why I Blame Jimmy Carter bit.ly/3osvMsx via @commentary
Markwayne Mullin (Republican-OK) said: Rather than support American energy independence, instead Biden turned to OPEC+ and emboldened our foreign adversaries. I was proud to join 145 of my @HouseGOP colleagues in urging @POTUS to reverse his failed energy policies that have directly led to our current energy crisis. Energy independence and national security go hand in hand.",692,0.0,14.0,0.0
40,c39,39_government_media_liberal_democracy,16,"Bernard Sanders (Independent-VT) said: The foundations of American democracy are threatened not only by extremism, but by ignorance and lack of knowledge. Now they’re giving him a platform to sow more disinformation. There’s an effort to criminalize journalists. twitter.com/GovParsonMO/st…
Brian J. Mast (Republican-FL) said: You know it’s bad legislation when even the liberal DC media won’t defend it. thehill.com/opinion/financ…
John Cornyn (Republican-TX) said: Asked whether government should do more or less to solve the country’s problems, 52% of Americans said government is doing too much.",7286,5.0,9.0,1.0
41,c40,40_china_taiwan_communist_threaten,15,"Marsha Blackburn (Republican-TN) said: The USA stands with Taiwan — Democracy’s first line of defense against Communist China. The United States must remain steadfast in our commitment to our friends in Taiwan. Their malice against personal freedom and human rights abuses cannot become the model for the world. nationalreview.com/2021/10/chinas…
Bill Hagerty (Republican-TN) said: China, like Russia, is testing &amp; fielding many new nuclear capabilities to threaten us &amp; our Allies. twitter.com/dimi/status/14…
Bill Hagerty (Republican-TN) said: Our leaders must be committed to addressing the threat the Chinese Communist Party poses to the United States.",9322,1.0,6.0,0.0
42,c41,41_newsletter_updates_weekly_subscribe,15,"Claudia Tenney (Republican-NY) said: My weekly newsletter is out and includes highlights and updates from this week in Congress. Click the link below to catch up with the latest! Tune in for a glimpse at New Hope, important legislative &amp; district updates, plus some great constituent highlights. Gov. https://t.co/RPy6ZQ7TiB
Don Bacon (Republican-NE) said: To stay updated with my office, sign up for our e-newsletter! For more updates sign up for my newsletter at: gonzalez.house.gov/contact/newsle… https://t.co/9Bll3pCNm8
Antonio Delgado (Democrat-NY) said: Click below to subscribe to my newsletter and get the latest updates on my work in DC &amp; #NY19 👇 delgado.house.gov/contact/newsle…
Lloyd Smucker (Republican-PA) said: Are you subscribed?",309,6.0,8.0,0.0
43,c42,42_gas_prices_energy_heating,14,"Kevin McCarthy (Republican-CA) said: The Democrats’ radical, anti-American energy policies are driving inflation sky-high. READ 👇👇👇
foxbusiness.com/politics/house…
Liz Cheney (Republican-WY) said: Democrats’ energy and economic policies could raise heating bills by 54% — this would be devastating for families in Wyoming and across the country. They can’t afford more reckless spending sprees. https://t.co/glsu2YVTat
Ben Cline (Republican-VA) said: Gas prices have risen 43% since the President took office.",4724,1.0,13.0,0.0
44,c43,43_mental_health_disorder_vitiligo,14,"Val Butler Demings (Democrat-FL) said: Everyone needs help sometimes. We will discuss services that are available. Mary E. Miller (Republican-IL) said: #BareShelvesBiden
Ken Buck (Republican-CO) said: Joe Biden caused this: 

wsj.com/articles/as-af…
Ron Wyden (Democrat-OR) said: My message before this morning’s @alzorswwa annual #Walk2EndAlz here in Portland was simple: everybody must do what they can to support both the researchers working to #ENDALZ, and the heroic caregivers helping those afflicted with this difficult disease. This issue is more pressing than ever given the impact of the pandemic. 1/3)
Pictured left to right: @Ojars_E_Kalnins  @RobBerschinski @kyleparkernet @kaltau https://t.co/yxBlDVtNqW",2423,7.0,4.0,0.0
45,c44,44_award_winning_congrats_congratulations,13,"James E. Clyburn (Democrat-SC) said: When I nominated Orangeburg's Jackie Booker Jr. to the U.S. Naval Academy in 2018, I knew he'd make our community proud. https://t.co/N5MOdI0tqD
Joe Neguse (Democrat-CO) said: @RepMGS @HouseDPCC @StaceyPlaskett @HouseDemocrats @RepSaraJacobs @JacksonLeeTX18 .@RepAuchincloss represents Massachusetts 4th District, and as a dad and a marine, he’s familiar with taking on new challenges. It’s no surprise he was awarded the Thomas Paine Award from @HouseDPCC. Her powerful communication skills are an invaluable asset to our Caucus. Congratulations on winning @HouseDPCC’s Thomas Paine Award for effective communication!",1887,6.0,2.0,0.0
46,c45,45_seniors_families_aging_communitybased,12,"Robert P. Casey, Jr. (Democrat-PA) said: RT if you think seniors and people with disabilities deserve better home care and care workers deserve better pay and benefits. # I was glad to visit with them today to learn about their important work &amp; read a story to their preschoolers. https://t.co/3kYPMH2pvy
Janice D. Schakowsky (Democrat-IL) said: Seniors and families are leaving their lifesaving medications at the 💊 counter because they cannot afford them. Homes like these are an opportunity for our state to give back. If we don’t invest in #HCBS and home care workers for #BuildBackBetter, we are setting up our seniors and loved ones to struggle with care as they age.",2295,7.0,2.0,0.0
47,c46,46_parents_board_fbi_parental,12,"House Committee on the Judiciary (N/A-N/A) said: The Justice Department wants to spy on parents at school board meetings. Except the “fact checkers” from the Washington Post like @GlennKesslerWP &amp; @rizzoTK. twitter.com/JamesRosenTV/s…
John Cornyn (Republican-TX) said: Democrats have declared war on ‘school board moms’ aei.org/op-eds/democra… via @AEI
John Cornyn (Republican-TX) said: Virginia Dad Takes On the School Board by @wjmcgurn wsj.com/articles/harry… via @WSJOpinion
Pete Stauber (Republican-MN) said: I recently signed onto a letter to President Biden, condemning his Administration's crackdown on parents who voice concerns at school board meetings. That's a situation no parent should have to face. My bipartisan bill would close the information gap on this disturbing practice so that we can create policies that keep kids safe.",3493,2.0,6.0,0.0
48,c47,47_israel_arab_accords_multilateral,11,"Ritchie Torres (Democrat-NY) said: The progress toward normalizing relations between Israel and the Arab world is one of the most improbable yet inspiring breakthroughs in the history of diplomacy. The “N7” convening of Israel &amp; six Arab countries represents a decisive paradigm shift in favor of peace. Josh Gottheimer (Democrat-NJ) said: That is why I’m a proud cosponsor of the Israel Relations Normalization Act of 2021 &amp; hope to see it become a framework for future normalization agreements. jewishinsider.com/2021/10/offici…
House Committee on Foreign Affairs (N/A-N/A) said: LR @RepMcCaul: ""I am thrilled to see this multilateral meeting between Israel and Arab countries as they work together to benefit all people of the Middle East. The Abraham Accords and similar agreements are game-changing.”",3012,5.0,2.0,0.0
49,c48,48_bullying_school_schools_racism,11,"Raja Krishnamoorthi (Democrat-IL) said: Growing up during any time is challenging, but in 2021 our teens are dealing with a global pandemic, a climate crisis, and outright racism and hate. We need to make the world safer for our children. 19thnews.org/2021/10/half-o…
Mondaire Jones (Democrat-NY) said: Bullying has no place in our schools, anywhere or any time. We need to be doing everything in our power to protect our students' mental and physical well-being.",881,9.0,0.0,0.0
