,name,chamber,party,state,district,date,content,replyCount,retweetCount,likeCount,quoteCount,handle,platform,url,photos,news,text,toke,topic,enga,engaSum
156,Margaret Wood Hassan,Senate,Democrat,NH,,2021-05-20 15:54:34.000000,"We cannot and we will not tolerate hate in this country. I was glad to see the President sign the COVID-19 Hate Crimes Act into law this afternoon.

NPR.ORG
Biden Signs The COVID-19 Hate Crimes Bill As Attacks On Asian Americans Rise",45,7,212,0,SenatorHassan,Facebook,https://facebook.com/SenatorHassan/posts/4410231555656283,,https://www.npr.org/2021/05/20/998599775/biden-to-sign-the-covid-19-hate-crimes-bill-as-anti-asian-american-attacks-rise,cannot tolerate hate country glad see president sign covid19 hate crimes act law afternoonnprorgbiden signs covid19 hate crimes bill attacks asian americans rise,"['cannot', 'tolerate', 'hate', 'country', 'glad', 'see', 'president', 'sign', 'covid19', 'hate', 'crimes', 'act', 'law', 'afternoonnprorgbiden', 'signs', 'covid19', 'hate', 'crimes', 'bill', 'attacks', 'asian', 'americans', 'rise']",17,264,12360
331,Virginia Foxx,House,Republican,NC,5,2021-05-20 13:11:45.000000,"Had a wonderful meeting with members of the Consulate General of Israel in Atlanta yesterday afternoon.

My support for Israel will never waver. You can count on it! 🇺🇸🇮🇱",45,0,219,0,RepVirginiaFoxx,Facebook,https://facebook.com/RepVirginiaFoxx/posts/5568785933194393,https://scontent-iad3-2.xx.fbcdn.net/v/t1.6435-9/fr/cp0/e15/q65/187871843_5568785313194455_8088301797609628436_n.jpg?_nc_cat=111&ccb=1-3&_nc_sid=110474&_nc_ohc=wcJR-ba4MnQAX-kQos2&_nc_ht=scontent-iad3-2.xx&tp=14&oh=ec01b970b79bd36205efd17daa4f4d20&oe=60CB55BD,,wonderful meeting members consulate general israel atlanta yesterday afternoonmy support israel never waver count,"['wonderful', 'meeting', 'members', 'consulate', 'general', 'israel', 'atlanta', 'yesterday', 'afternoonmy', 'support', 'israel', 'never', 'waver', 'count']",05,264,5633
194,Todd Young,Senate,Republican,IN,,2021-05-20 13:00:05.000000,We're in the middle of a crisis at the border and Democrats just won't listen.,170,0,89,0,SenatorToddYoung,Facebook,https://facebook.com/SenatorToddYoung/videos/785750752057807,,,middle crisis border democrats wont listen,"['middle', 'crisis', 'border', 'democrats', 'wont', 'listen']",02,259,3333
306,David N. Cicilline,House,Democrat,RI,1,2021-05-20 14:54:35.000000,"Here is the resolution I introduced today to censure Rep. Gosar for his attempt last week to rewrite the history of the January 6th Insurrection.

I have also introduced resolutions to censure Reps Hice and Clyde for their efforts to do the same.",44,0,214,0,CongressmanDavidCicilline,Facebook,https://facebook.com/CongressmanDavidCicilline/posts/3919864941382735,https://scontent-iad3-2.xx.fbcdn.net/v/t1.6435-9/fr/cp0/e15/q65/186510257_3919864661382763_7367008476408281532_n.jpg?_nc_cat=110&ccb=1-3&_nc_sid=110474&_nc_ohc=Y6SdGaFlY7MAX91yj3l&_nc_ht=scontent-iad3-2.xx&tp=14&oh=8b62209994672355e9201bc9ace5897f&oe=60CB79EB,,resolution introduced today censure rep gosar attempt last week rewrite history january 6th insurrectioni also introduced resolutions censure reps hice clyde efforts,"['resolution', 'introduced', 'today', 'censure', 'rep', 'gosar', 'attempt', 'last', 'week', 'rewrite', 'history', 'january', '6th', 'insurrectioni', 'also', 'introduced', 'resolutions', 'censure', 'reps', 'hice', 'clyde', 'efforts']",27,258,19967
92,Stacey E. Plaskett,House,Democrat,VI,0,2021-05-20 02:42:41+00:00,Rest welll @PaulEalyMooney rest well twitter.com/PaulEalyMooney…,3,21,229,3,staceyplaskett,Twitter,https://twitter.com/StaceyPlaskett/status/1395208327324393478,,['https://twitter.com/PaulEalyMooney/status/1395123592795414530'],rest welll rest well twittercompaulealymooney,"['rest', 'welll', 'rest', 'well', 'twittercompaulealymooney']",03,256,7807
99,Marsha Blackburn,Senate,Republican,TN,,2021-05-20 22:06:46.000000,The Biden admin is trafficking migrant children into Tennessee. We need answers from now. https://www.youtube.com/watch?v=-eR8qGLrbks,97,0,154,0,marshablackburn,Facebook,https://facebook.com/marshablackburn/videos/924238911733312,,https://www.youtube.com/watch?v=-eR8qGLrbks,biden admin trafficking migrant children tennessee need answers,"['biden', 'admin', 'trafficking', 'migrant', 'children', 'tennessee', 'need', 'answers']",14,251,8462
31,Lucy McBath,House,Democrat,GA,6,2021-05-20 21:05:00+00:00,"We held a hearing in @HouseJudiciary today about the tools that will help save American lives from the tragic heartbreak of gun violence. I lost my son nearly 10 years ago, and not a day goes by that I don't think about him.

Listen to my questions for our witnesses ⤵️ https://t.co/j5TDSYtWVJ",10,62,174,5,replucymcbath,Twitter,https://twitter.com/RepLucyMcBath/status/1395485733343965187,https://pbs.twimg.com/media/E13CUQQXoAAngua.jpg,[],held hearing today tools help save american lives tragic heartbreak gun violence lost son nearly years ago day goes dont think himlisten questions witnesses,"['held', 'hearing', 'today', 'tools', 'help', 'save', 'american', 'lives', 'tragic', 'heartbreak', 'gun', 'violence', 'lost', 'son', 'nearly', 'years', 'ago', 'day', 'goes', 'dont', 'think', 'himlisten', 'questions', 'witnesses']",20,251,1766
291,Henry Cuellar,House,Democrat,TX,28,2021-05-20 15:50:06.000000,"I'm heading home to Laredo! I spent this week working to open our southern border land ports of entry and securing funds for our local university students. TX-28 is always on my mind, in DC and at home.",39,0,207,0,152569121550,Facebook,https://facebook.com/152569121550/posts/10157920992471551,https://scontent-iad3-2.xx.fbcdn.net/v/t1.6435-9/fr/cp0/e15/q65/186508571_10157920990881551_7226577703293783950_n.jpg?_nc_cat=108&ccb=1-3&_nc_sid=110474&_nc_ohc=QYcdVtqi0D0AX9U1s3s&_nc_ht=scontent-iad3-2.xx&tp=14&oh=94520da3450b23d657dff3b85ceb2bcf&oe=60CB5406,,im heading home laredo spent week working open southern border land ports entry securing funds local university students tx28 always mind dc home,"['im', 'heading', 'home', 'laredo', 'spent', 'week', 'working', 'open', 'southern', 'border', 'land', 'ports', 'entry', 'securing', 'funds', 'local', 'university', 'students', 'tx28', 'always', 'mind', 'dc', 'home']",02,246,3333
242,Michael F. Bennet,Senate,Democrat,CO,,2021-05-20 09:15:49.000000,"We’re urging the Department of Health and Human Services to swiftly implement the Title X, family planning rule — an important step toward ensuring patients are informed about the full range of reproductive health care options available to them.",25,0,207,0,senbennetco,Facebook,https://facebook.com/senbennetco/posts/10159163599047733,https://scontent-iad3-2.xx.fbcdn.net/v/t1.6435-9/fr/cp0/e15/q65/188325274_10159163589392733_5080796900821849853_n.jpg?_nc_cat=111&ccb=1-3&_nc_sid=8024bb&_nc_ohc=eQy39F6sfqUAX9kVW4G&_nc_ht=scontent-iad3-2.xx&tp=14&oh=587548b1b2a1bc7ea11da9351508d976&oe=60CC19BA,,urging department health human services swiftly implement title x family planning rule important step toward ensuring patients informed full range reproductive health care options available,"['urging', 'department', 'health', 'human', 'services', 'swiftly', 'implement', 'title', 'x', 'family', 'planning', 'rule', 'important', 'step', 'toward', 'ensuring', 'patients', 'informed', 'full', 'range', 'reproductive', 'health', 'care', 'options', 'available']",24,232,8411
111,Tammy Duckworth,Senate,Democrat,IL,,2021-05-20 18:56:36.000000,"Child care is not nice to have, it’s a must have. And ensuring child care providers can keep their doors open means making sure they have access to needed resources.

I'm proud to join Sen. Jacky Rosen and Senator Joni Ernst in introducing the Small Business Child Care Investment Act.

DUCKWORTH.SENATE.GOV
Duckworth Joins Rosen and Ernst in Introducing Bipartisan, Bicameral Legislation to Expand Child Care Availability | U.S. Senator Tammy Duckworth of Illinois",25,11,195,0,SenDuckworth,Facebook,https://facebook.com/SenDuckworth/posts/1957081811132425,,https://www.duckworth.senate.gov/news/press-releases/duckworth-joins-rosen-and-ernst-in-introducing-bipartisan-bicameral-legislation-to-expand-child-care-availability,child care nice must ensuring child care providers keep doors open means making sure access needed resourcesim proud join sen jacky rosen senator joni ernst introducing small business child care investment actduckworthsenategovduckworth joins rosen ernst introducing bipartisan bicameral legislation expand child care availability us senator tammy duckworth illinois,"['child', 'care', 'nice', 'must', 'ensuring', 'child', 'care', 'providers', 'keep', 'doors', 'open', 'means', 'making', 'sure', 'access', 'needed', 'resourcesim', 'proud', 'join', 'sen', 'jacky', 'rosen', 'senator', 'joni', 'ernst', 'introducing', 'small', 'business', 'child', 'care', 'investment', 'actduckworthsenategovduckworth', 'joins', 'rosen', 'ernst', 'introducing', 'bipartisan', 'bicameral', 'legislation', 'expand', 'child', 'care', 'availability', 'us', 'senator', 'tammy', 'duckworth', 'illinois']",08,231,8964
182,Jon Tester,Senate,Democrat,MT,,2021-05-20 14:07:41.000000,"I had the honor of welcoming Montana’s very own Gen. Matthew T. Quinn at a Senate Veterans' Affairs Committee confirmation hearing yesterday to consider his nomination to serve as Under Secretary for Memorial Affairs.

Having worked closely with him as the head of Montana’s National Guard, Quinn cares deeply about our servicemembers, veterans and their families, and I have full confidence he can get the job done.",6,0,224,0,senatortester,Facebook,https://facebook.com/senatortester/posts/10159252036476665,,,honor welcoming montanas gen matthew quinn senate veterans affairs committee confirmation hearing yesterday consider nomination serve secretary memorial affairshaving worked closely head montanas national guard quinn cares deeply servicemembers veterans families full confidence get job done,"['honor', 'welcoming', 'montanas', 'gen', 'matthew', 'quinn', 'senate', 'veterans', 'affairs', 'committee', 'confirmation', 'hearing', 'yesterday', 'consider', 'nomination', 'serve', 'secretary', 'memorial', 'affairshaving', 'worked', 'closely', 'head', 'montanas', 'national', 'guard', 'quinn', 'cares', 'deeply', 'servicemembers', 'veterans', 'families', 'full', 'confidence', 'get', 'job', 'done']",23,230,667
83,Raja Krishnamoorthi,House,Democrat,IL,8,2021-05-20 14:30:31+00:00,"Yesterday, I announced my Nullifying Opportunities for Variants to Infect &amp; Decimate Act (NOVID) Act. This bill would protect Americans from new variants of COVID by helping global efforts to defeat outbreaks &amp; reduce the risk of vaccine-resistant strains.
krishnamoorthi.house.gov/media/press-re…",5,74,148,3,congressmanraja,Twitter,https://twitter.com/CongressmanRaja/status/1395386456982630400,,['https://krishnamoorthi.house.gov/media/press-releases/no-more-covid-congressman-krishnamoorthi-announces-novid-act-protect-us-risk'],yesterday announced nullifying opportunities variants infect decimate act novid act bill would protect americans new variants covid helping global efforts defeat outbreaks reduce risk vaccineresistant strainskrishnamoorthihousegovmediapressre,"['yesterday', 'announced', 'nullifying', 'opportunities', 'variants', 'infect', 'decimate', 'act', 'novid', 'act', 'bill', 'would', 'protect', 'americans', 'new', 'variants', 'covid', 'helping', 'global', 'efforts', 'defeat', 'outbreaks', 'reduce', 'risk', 'vaccineresistant', 'strainskrishnamoorthihousegovmediapressre']",26,230,959
326,Bob Gibbs,House,Republican,OH,7,2021-05-20 13:47:24.000000,"Good. I fail to see the utility of a blue-ribbon commission on this topic. Firstly, there are already numerous ongoing investigations, including the Department of Justice’s own prosecution of those who engaged in this horrific attack. Secondly, we already know it was pre-meditated and not spontaneous. Thirdly, we already know of the security failures in the lead-up to January 6th, which are being addressed in the supplemental security funding legislation. 𝙇𝙖𝙨𝙩𝙡𝙮, 𝙩𝙝𝙚𝙧𝙚 𝙝𝙖𝙫𝙚 𝙗𝙚𝙚𝙣 𝙨𝙪𝙨𝙩𝙖𝙞𝙣𝙚𝙙 𝙖𝙩𝙩𝙖𝙘𝙠𝙨 𝙤𝙣 𝙛𝙚𝙙𝙚𝙧𝙖𝙡 𝙛𝙖𝙘𝙞𝙡𝙞𝙩𝙞𝙚𝙨 𝙖𝙡𝙡 𝙤𝙛 𝙡𝙖𝙨𝙩 𝙮𝙚𝙖𝙧, 𝙖𝙨 𝘼𝙣𝙩𝙞𝙛𝙖 𝙖𝙣𝙙 𝙖𝙛𝙛𝙞𝙡𝙞𝙖𝙩𝙚𝙙 𝙘𝙧𝙞𝙢𝙞𝙣𝙖𝙡𝙨 𝙧𝙤𝙪𝙩𝙞𝙣𝙚𝙡𝙮 𝙖𝙩𝙩𝙚𝙢𝙥𝙩𝙚𝙙 𝙩𝙤 𝙗𝙪𝙧𝙣 𝙙𝙤𝙬𝙣 𝙖 𝙛𝙚𝙙𝙚𝙧𝙖𝙡 𝙘𝙤𝙪𝙧𝙩𝙝𝙤𝙪𝙨𝙚 𝙞𝙣 𝙋𝙤𝙧𝙩𝙡𝙖𝙣𝙙, 𝙊𝙧𝙚𝙜𝙤𝙣. 𝙔𝙚𝙩 𝙩𝙝𝙚𝙨𝙚 𝙖𝙩𝙩𝙖𝙘𝙠𝙨 𝙤𝙣 𝙖 𝙛𝙚𝙙𝙚𝙧𝙖𝙡 𝙞𝙣𝙨𝙩𝙞𝙩𝙪𝙩𝙞𝙤𝙣 𝙖𝙧𝙚 𝙗𝙚𝙞𝙣𝙜 𝙨𝙬𝙚𝙥𝙩 𝙪𝙣𝙙𝙚𝙧 𝙩𝙝𝙚 𝙧𝙪𝙜 𝙗𝙮 𝘾𝙤𝙣𝙜𝙧𝙚𝙨𝙨𝙞𝙤𝙣𝙖𝙡 𝘿𝙚𝙢𝙤𝙘𝙧𝙖𝙩𝙨. All the creation of this panel would do is provide another political circus for Democrats and the mainstream media to attack Republicans. Add this to another in the long list of commissions that investigates, deliberates, and opines but ultimately does nothing.

APNEWS.COM
McConnell hits 'pause' on Dems effort to create Jan. 6 panel",57,18,154,0,RepBobGibbs,Facebook,https://facebook.com/RepBobGibbs/posts/4628773450470304,,https://apnews.com/article/mccarthy-republicans-insurrection-commission-e0ffe4990ad8f2634ca83b95a2c2c64c,good fail see utility blueribbon commission topic firstly already numerous ongoing investigations including department justices prosecution engaged horrific attack secondly already know premeditated spontaneous thirdly already know security failures leadup january 6th addressed supplemental security funding legislation creation panel would provide another political circus democrats mainstream media attack republicans add another long list commissions investigates deliberates opines ultimately nothingapnewscommcconnell hits pause dems effort create jan panel,"['good', 'fail', 'see', 'utility', 'blueribbon', 'commission', 'topic', 'firstly', 'already', 'numerous', 'ongoing', 'investigations', 'including', 'department', 'justices', 'prosecution', 'engaged', 'horrific', 'attack', 'secondly', 'already', 'know', 'premeditated', 'spontaneous', 'thirdly', 'already', 'know', 'security', 'failures', 'leadup', 'january', '6th', 'addressed', 'supplemental', 'security', 'funding', 'legislation', 'creation', 'panel', 'would', 'provide', 'another', 'political', 'circus', 'democrats', 'mainstream', 'media', 'attack', 'republicans', 'add', 'another', 'long', 'list', 'commissions', 'investigates', 'deliberates', 'opines', 'ultimately', 'nothingapnewscommcconnell', 'hits', 'pause', 'dems', 'effort', 'create', 'jan', 'panel']",27,229,19967
76,Brian J. Mast,House,Republican,FL,18,2021-05-20 16:00:01+00:00,"Our ally Israel is being attacked. 

House Democrats are doing nothing to hold Hamas accountable.

Today, I joined my colleagues for a press conference to affirm our support for Israel. https://t.co/wCnMwX2YZW",29,34,160,3,repbrianmast,Twitter,https://twitter.com/RepBrianMast/status/1395408982936674308,https://pbs.twimg.com/amplify_video_thumb/1395407140857188356/img/ObRV0vOsymNuN6vl.jpg,[],ally israel attacked house democrats nothing hold hamas accountabletoday joined colleagues press conference affirm support israel,"['ally', 'israel', 'attacked', 'house', 'democrats', 'nothing', 'hold', 'hamas', 'accountabletoday', 'joined', 'colleagues', 'press', 'conference', 'affirm', 'support', 'israel']",18,226,126933
218,Lisa Murkowski,Senate,Republican,AK,,2021-05-20 11:01:03.000000,"It is no secret that I am passionate about the Arctic. I have consistently stressed that the United States, as an Arctic nation, should strengthen its role in the region and as a global leader. I’m proud of the work our country has done at the Arctic Council over the years, and I was encouraged by the information conveyed to me by fellow members of the official U.S. delegation and delegation members of other Arctic nations. I was especially encouraged by the wide array of meetings I have been able to take part in. I’ve met with a so many passionate people who are dedicated to working cooperatively to care for those that call the Arctic region home, for our shared environment, for the shared food source, and more.",53,0,169,0,SenLisaMurkowski,Facebook,https://facebook.com/SenLisaMurkowski/posts/10165036944220291,https://scontent-iad3-2.xx.fbcdn.net/v/t1.6435-9/fr/cp0/e15/q65/188752603_10165036943625291_1078995018046120987_n.jpg?_nc_cat=103&ccb=1-3&_nc_sid=110474&_nc_ohc=B49y1bOspZEAX89XC28&_nc_ht=scontent-iad3-2.xx&tp=14&oh=0a8ee3105ae70f1280490db42f68fe1a&oe=60CE0351,,secret passionate arctic consistently stressed united states arctic nation strengthen role region global leader im proud work country done arctic council years encouraged information conveyed fellow members official us delegation delegation members arctic nations especially encouraged wide array meetings able take part ive met many passionate people dedicated working cooperatively care call arctic region home shared environment shared food source,"['secret', 'passionate', 'arctic', 'consistently', 'stressed', 'united', 'states', 'arctic', 'nation', 'strengthen', 'role', 'region', 'global', 'leader', 'im', 'proud', 'work', 'country', 'done', 'arctic', 'council', 'years', 'encouraged', 'information', 'conveyed', 'fellow', 'members', 'official', 'us', 'delegation', 'delegation', 'members', 'arctic', 'nations', 'especially', 'encouraged', 'wide', 'array', 'meetings', 'able', 'take', 'part', 'ive', 'met', 'many', 'passionate', 'people', 'dedicated', 'working', 'cooperatively', 'care', 'call', 'arctic', 'region', 'home', 'shared', 'environment', 'shared', 'food', 'source']",11,222,4752
104,Susan M. Collins,Senate,Republican,ME,,2021-05-20 19:57:49.000000,"This afternoon, I attended a White House signing ceremony for the legislation I co-authored with Senator Mazie K. Hirono to address hate crimes directed at Asian Americans and Pacific Islanders. This new law will marshal additional resources to help stop these despicable acts of racial discrimination and violence.

NPR.ORG
Here's What The New Hate Crimes Law Aims To Do As Attacks On Asian Americans Rise",98,12,109,0,susancollins,Facebook,https://facebook.com/susancollins/posts/10160860352728362,,https://www.npr.org/2021/05/20/998599775/biden-to-sign-the-covid-19-hate-crimes-bill-as-anti-asian-american-attacks-rise,afternoon attended white house signing ceremony legislation coauthored senator mazie k hirono address hate crimes directed asian americans pacific islanders new law marshal additional resources help stop despicable acts racial discrimination violencenprorgheres new hate crimes law aims attacks asian americans rise,"['afternoon', 'attended', 'white', 'house', 'signing', 'ceremony', 'legislation', 'coauthored', 'senator', 'mazie', 'k', 'hirono', 'address', 'hate', 'crimes', 'directed', 'asian', 'americans', 'pacific', 'islanders', 'new', 'law', 'marshal', 'additional', 'resources', 'help', 'stop', 'despicable', 'acts', 'racial', 'discrimination', 'violencenprorgheres', 'new', 'hate', 'crimes', 'law', 'aims', 'attacks', 'asian', 'americans', 'rise']",17,219,12360
221,Susan M. Collins,Senate,Republican,ME,,2021-05-20 10:44:28.000000,"DDG-51 destroyers are the workhorses of the Navy and defend our interests around the globe. The Department of Defense’s reported plan to request only one new destroyer next year would send the wrong message to China and would set back efforts to increase the size of our fleet. I sent a letter with Senator Angus S. King, Jr., Congresswoman Chellie Pingree, and Congressman Jared Golden to President Biden expressing our opposition to this proposal that would harm our national security as well as the hardworking men and women at Bath Iron Works.

PRESSHERALD.COM
Report: Administration to cut number of destroyers next year, may impact BIW",111,35,69,0,susancollins,Facebook,https://facebook.com/susancollins/posts/10160858839543362,,https://www.pressherald.com/2021/05/19/administration-may-cut-number-of-destroyers-from-two-to-one-next-year-may-impact-biw/,ddg51 destroyers workhorses navy defend interests around globe department defenses reported plan request one new destroyer next year would send wrong message china would set back efforts increase size fleet sent letter senator angus king jr congresswoman chellie pingree congressman jared golden president biden expressing opposition proposal would harm national security well hardworking men women bath iron workspressheraldcomreport administration cut number destroyers next year may impact biw,"['ddg51', 'destroyers', 'workhorses', 'navy', 'defend', 'interests', 'around', 'globe', 'department', 'defenses', 'reported', 'plan', 'request', 'one', 'new', 'destroyer', 'next', 'year', 'would', 'send', 'wrong', 'message', 'china', 'would', 'set', 'back', 'efforts', 'increase', 'size', 'fleet', 'sent', 'letter', 'senator', 'angus', 'king', 'jr', 'congresswoman', 'chellie', 'pingree', 'congressman', 'jared', 'golden', 'president', 'biden', 'expressing', 'opposition', 'proposal', 'would', 'harm', 'national', 'security', 'well', 'hardworking', 'men', 'women', 'bath', 'iron', 'workspressheraldcomreport', 'administration', 'cut', 'number', 'destroyers', 'next', 'year', 'may', 'impact', 'biw']",20,215,1766
186,Mark Kelly,Senate,Democrat,AZ,,2021-05-20 13:44:03.000000,"Gabby Giffords and I have been going to shows at The Rialto for years. They're a part of what makes our community so special. Venues like them also have an economic impact that can't be understated and we have to protect that.

INSIDETUCSONBUSINESS.COM
Kelly visits local venues, hopes federal funding will open them soon",6,8,200,0,SenMarkKelly,Facebook,https://facebook.com/SenMarkKelly/posts/233565161898685,,https://www.insidetucsonbusiness.com/business/kelly-visits-local-venues-hopes-federal-funding-will-open-them-soon/article_fc9ceb0c-af4a-11eb-aa76-4bd38becd744.html,gabby giffords going shows rialto years theyre part makes community special venues like also economic impact cant understated protect thatinsidetucsonbusinesscomkelly visits local venues hopes federal funding open soon,"['gabby', 'giffords', 'going', 'shows', 'rialto', 'years', 'theyre', 'part', 'makes', 'community', 'special', 'venues', 'like', 'also', 'economic', 'impact', 'cant', 'understated', 'protect', 'thatinsidetucsonbusinesscomkelly', 'visits', 'local', 'venues', 'hopes', 'federal', 'funding', 'open', 'soon']",27,214,19967
134,Catherine Cortez Masto,Senate,Democrat,NV,,2021-05-20 17:06:53.000000,"We’ve got to root out hate and racism in our nation. I’m proud to say our COVID-19 Hate Crimes Act is now law. This is an important step in the effort to protect AAPI communities across the country and #StopAsianHate.

CBSNEWS.COM
Biden signs bill to combat hate crimes against Asian Americans",32,11,168,0,SenatorCortezMasto,Facebook,https://facebook.com/SenatorCortezMasto/posts/4191593884217653,,https://www.cbsnews.com/news/joe-biden-signs-anti-asian-hate-crime-bill-live-stream-2021-05-20/,weve got root hate racism nation im proud say covid19 hate crimes act law important step effort protect aapi communities across country stopasianhatecbsnewscombiden signs bill combat hate crimes asian americans,"['weve', 'got', 'root', 'hate', 'racism', 'nation', 'im', 'proud', 'say', 'covid19', 'hate', 'crimes', 'act', 'law', 'important', 'step', 'effort', 'protect', 'aapi', 'communities', 'across', 'country', 'stopasianhatecbsnewscombiden', 'signs', 'bill', 'combat', 'hate', 'crimes', 'asian', 'americans']",17,211,12360
