,name,chamber,party,state,district,date,content,replyCount,retweetCount,likeCount,quoteCount,handle,platform,url,photos,news,text,toke,topic,enga,engaSum
244,Bernard Sanders,Senate,Independent,VT,,2021-05-20 09:09:46.000000,"At a moment when U.S.-made bombs are devastating Gaza, and killing women and children, we cannot simply let another huge arms sale go through without even a Congressional debate. I believe that the United States must help lead the way to a peaceful and prosperous future for both Israelis and Palestinians. We need to take a hard look at whether the sale of these weapons is actually helping do that, or whether it is simply fueling conflict.

WASHINGTONPOST.COM
Sen. Bernie Sanders to introduce resolution of disapproval on $735 million U.S. arms sale to Israel",3081,8264,61071,0,senatorsanders,Facebook,https://facebook.com/senatorsanders/posts/10160056636007908,,https://www.washingtonpost.com/politics/2021/05/20/sen-bernie-sanders-introduce-resolution-disapproval-735-million-us-arms-sale-israel/?utm_medium=social&utm_source=twitter&utm_campaign=wp_mainhttps://www.washingtonpost.com/politics/2021/05/20/sen-bernie-sanders-introduce-resolution-disapproval-735-million-us-arms-sale-israel/?utm_medium=social&utm_source=twitter&utm_campaign=wp_main,moment usmade bombs devastating gaza killing women children cannot simply let another huge arms sale go without even congressional debate believe united states must help lead way peaceful prosperous future israelis palestinians need take hard look whether sale weapons actually helping whether simply fueling conflictwashingtonpostcomsen bernie sanders introduce resolution disapproval million us arms sale israel,"['moment', 'usmade', 'bombs', 'devastating', 'gaza', 'killing', 'women', 'children', 'cannot', 'simply', 'let', 'another', 'huge', 'arms', 'sale', 'go', 'without', 'even', 'congressional', 'debate', 'believe', 'united', 'states', 'must', 'help', 'lead', 'way', 'peaceful', 'prosperous', 'future', 'israelis', 'palestinians', 'need', 'take', 'hard', 'look', 'whether', 'sale', 'weapons', 'actually', 'helping', 'whether', 'simply', 'fueling', 'conflictwashingtonpostcomsen', 'bernie', 'sanders', 'introduce', 'resolution', 'disapproval', 'million', 'us', 'arms', 'sale', 'israel']",18,72416,126933
366,Jim Jordan,House,Republican,OH,4,2021-05-20 10:17:46.000000,Why were American tax dollars funding research in a lab in China?,4915,0,20935,0,repjimjordan,Facebook,https://facebook.com/repjimjordan/posts/10159275705086460,,,american tax dollars funding research lab china,"['american', 'tax', 'dollars', 'funding', 'research', 'lab', 'china']",25,25850,27034
120,Bernard Sanders,Senate,Independent,VT,,2021-05-20 18:14:04.000000,"Let us hope that the ceasefire in Gaza holds. But that's not enough. Our job now is to support desperately needed humanitarian and reconstruction aid to Gaza’s people, and find a way to finally bring peace to the region.",1095,0,13982,0,senatorsanders,Facebook,https://facebook.com/senatorsanders/posts/10160057656552908,,,let us hope ceasefire gaza holds thats enough job support desperately needed humanitarian reconstruction aid gazas people find way finally bring peace region,"['let', 'us', 'hope', 'ceasefire', 'gaza', 'holds', 'thats', 'enough', 'job', 'support', 'desperately', 'needed', 'humanitarian', 'reconstruction', 'aid', 'gazas', 'people', 'find', 'way', 'finally', 'bring', 'peace', 'region']",18,15077,126933
235,Ted Cruz,Senate,Republican,TX,,2021-05-20 09:53:34.000000,We stand with Israel.,628,0,9657,0,SenatorTedCruz,Facebook,https://facebook.com/SenatorTedCruz/videos/3966867453349376,,,stand israel,"['stand', 'israel']",18,10285,126933
138,Rand Paul,Senate,Republican,KY,,2021-05-20 16:43:28.000000,"""The federal government has broken the bank with an astounding $6+ trillion in (ostensibly) pandemic-related spending to date, and President Biden wants to spend trillions more. Unfortunately, many Republicans in Congress have been too inconsistent on this issue to protest this spending binge in any meaningful way.""

FEE.ORG
Rand Paul Warns America: Time to ‘Wake Up’ to ‘Profound Repercussions’ of Biden’s Spending Binge | Brad Polumbo",270,988,7825,0,SenatorRandPaul,Facebook,https://facebook.com/SenatorRandPaul/posts/4296853933700710,,https://fee.org/articles/rand-paul-warns-america-time-to-wake-up-to-profound-repercussions-of-biden-s-spending-binge/,federal government broken bank astounding trillion ostensibly pandemicrelated spending date president biden wants spend trillions unfortunately many republicans congress inconsistent issue protest spending binge meaningful wayfeeorgrand paul warns america time wake profound repercussions bidens spending binge brad polumbo,"['federal', 'government', 'broken', 'bank', 'astounding', 'trillion', 'ostensibly', 'pandemicrelated', 'spending', 'date', 'president', 'biden', 'wants', 'spend', 'trillions', 'unfortunately', 'many', 'republicans', 'congress', 'inconsistent', 'issue', 'protest', 'spending', 'binge', 'meaningful', 'wayfeeorgrand', 'paul', 'warns', 'america', 'time', 'wake', 'profound', 'repercussions', 'bidens', 'spending', 'binge', 'brad', 'polumbo']",27,9083,19967
219,Ted Cruz,Senate,Republican,TX,,2021-05-20 10:58:45.000000,no text,446,0,7765,0,SenatorTedCruz,Facebook,https://facebook.com/SenatorTedCruz/posts/3922930144485923,https://scontent-iad3-2.xx.fbcdn.net/v/t1.6435-9/fr/cp0/e15/q65/188953214_3922930064485931_2273084359369363938_n.jpg?_nc_cat=101&ccb=1-3&_nc_sid=8024bb&_nc_ohc=tCSSswsrSKwAX-eQFl_&_nc_ht=scontent-iad3-2.xx&tp=14&oh=cbc9b48d417be731eecbd50d2cc7eace&oe=60CCF32B,,text,['text'],10,8211,25575
115,Elizabeth Warren,Senate,Democrat,MA,,2021-05-20 18:39:14.000000,"This ceasefire is good news, but it won’t bring back the hundreds of innocent civilians killed or prevent future violence. The Biden administration must press for a just, lasting two-state agreement, and that starts with taking all appropriate steps to end the occupation.

NYTIMES.COM
Live Updates: Israel and Hamas Agree to Cease-Fire in Gaza Conflict",499,542,6227,0,senatorelizabethwarren,Facebook,https://facebook.com/senatorelizabethwarren/posts/1848554391973712,,https://www.nytimes.com/live/2021/05/20/world/israel-palestine-gaza,ceasefire good news wont bring back hundreds innocent civilians killed prevent future violence biden administration must press lasting twostate agreement starts taking appropriate steps end occupationnytimescomlive updates israel hamas agree ceasefire gaza conflict,"['ceasefire', 'good', 'news', 'wont', 'bring', 'back', 'hundreds', 'innocent', 'civilians', 'killed', 'prevent', 'future', 'violence', 'biden', 'administration', 'must', 'press', 'lasting', 'twostate', 'agreement', 'starts', 'taking', 'appropriate', 'steps', 'end', 'occupationnytimescomlive', 'updates', 'israel', 'hamas', 'agree', 'ceasefire', 'gaza', 'conflict']",18,7268,126933
203,Ted Cruz,Senate,Republican,TX,,2021-05-20 12:24:38.000000,no text,382,753,6090,0,SenatorTedCruz,Facebook,https://facebook.com/SenatorTedCruz/posts/3923125034466434,,https://www.breitbart.com/clips/2021/05/20/cruz-hamas-rockets-fired-into-israel-might-as-well-have-joe-bidens-name-written-on-the-side-on-it/,text,['text'],10,7225,25575
336,Jim Jordan,House,Republican,OH,4,2021-05-20 12:56:44.000000,"We already have open borders. The last thing we should do is:

1. Reduce ICE detention capacity.

2 Terminate agreements that help identify criminal aliens.

3. Continue to incentivize illegal immigration.",318,0,5812,0,repjimjordan,Facebook,https://facebook.com/repjimjordan/posts/10159276061306460,,,already open borders last thing is1 reduce ice detention capacity2 terminate agreements help identify criminal aliens3 continue incentivize illegal immigration,"['already', 'open', 'borders', 'last', 'thing', 'is1', 'reduce', 'ice', 'detention', 'capacity2', 'terminate', 'agreements', 'help', 'identify', 'criminal', 'aliens3', 'continue', 'incentivize', 'illegal', 'immigration']",22,6130,14378
209,Elizabeth Warren,Senate,Democrat,MA,,2021-05-20 11:41:01.000000,"My colleagues in the Massachusetts delegation and I commend DHS's decision to end its immigration-detention contracts with the Bristol County Sheriff's Office. This is a just and humane step, and a victory for the detainees, families, lawyers, and advocates who pushed for accountability.

During the Trump administration, I called for an Inspector General investigation into the horrifying reports of human rights violations at the Irwin County Detention Center in Georgia. DHS absolutely made the right decision to cut ties with this facility.

WASHINGTONPOST.COM
ICE to stop detaining immigrants at two county jails under federal investigation",120,303,5433,0,senatorelizabethwarren,Facebook,https://facebook.com/senatorelizabethwarren/posts/1848258452003306,,https://www.washingtonpost.com/immigration/ice-detentions-county-jails-halted/2021/05/20/9c0bdd1e-b8de-11eb-a6b1-81296da0339b_story.html,colleagues massachusetts delegation commend dhss decision end immigrationdetention contracts bristol county sheriffs office humane step victory detainees families lawyers advocates pushed accountabilityduring trump administration called inspector general investigation horrifying reports human rights violations irwin county detention center georgia dhs absolutely made right decision cut ties facilitywashingtonpostcomice stop detaining immigrants two county jails federal investigation,"['colleagues', 'massachusetts', 'delegation', 'commend', 'dhss', 'decision', 'end', 'immigrationdetention', 'contracts', 'bristol', 'county', 'sheriffs', 'office', 'humane', 'step', 'victory', 'detainees', 'families', 'lawyers', 'advocates', 'pushed', 'accountabilityduring', 'trump', 'administration', 'called', 'inspector', 'general', 'investigation', 'horrifying', 'reports', 'human', 'rights', 'violations', 'irwin', 'county', 'detention', 'center', 'georgia', 'dhs', 'absolutely', 'made', 'right', 'decision', 'cut', 'ties', 'facilitywashingtonpostcomice', 'stop', 'detaining', 'immigrants', 'two', 'county', 'jails', 'federal', 'investigation']",22,5856,14378
174,Bernard Sanders,Senate,Independent,VT,,2021-05-20 14:30:31.000000,"To understand this war, we must understand what the Palestinian people have been enduring under blockade and occupation. I believe we must stand in solidarity with those Palestinians and Israelis working to build a future of equality and peaceful coexistence.",457,0,5305,0,senatorsanders,Facebook,https://facebook.com/senatorsanders/videos/806466439995024,,,understand war must understand palestinian people enduring blockade occupation believe must stand solidarity palestinians israelis working build future equality peaceful coexistence,"['understand', 'war', 'must', 'understand', 'palestinian', 'people', 'enduring', 'blockade', 'occupation', 'believe', 'must', 'stand', 'solidarity', 'palestinians', 'israelis', 'working', 'build', 'future', 'equality', 'peaceful', 'coexistence']",18,5762,126933
200,Elizabeth Warren,Senate,Democrat,MA,,2021-05-20 12:34:43.000000,"The US can no longer be complicit in the dire humanitarian crisis in Yemen. I’m leading a call for President Biden to use every tool available to end the Saudis' blockade tactics that are preventing fuel, food, and medicine from reaching desperate Yemeni people.

CNN.COM
Senators call on Biden administration to demand Saudi end blockade tactics on a starving Yemen",161,432,4816,0,senatorelizabethwarren,Facebook,https://facebook.com/senatorelizabethwarren/posts/1848356718660146,,https://www.cnn.com/2021/05/20/politics/yemen-letter-biden-saudis/index.html,us longer complicit dire humanitarian crisis yemen im leading call president biden use every tool available end saudis blockade tactics preventing fuel food medicine reaching desperate yemeni peoplecnncomsenators call biden administration demand saudi end blockade tactics starving yemen,"['us', 'longer', 'complicit', 'dire', 'humanitarian', 'crisis', 'yemen', 'im', 'leading', 'call', 'president', 'biden', 'use', 'every', 'tool', 'available', 'end', 'saudis', 'blockade', 'tactics', 'preventing', 'fuel', 'food', 'medicine', 'reaching', 'desperate', 'yemeni', 'peoplecnncomsenators', 'call', 'biden', 'administration', 'demand', 'saudi', 'end', 'blockade', 'tactics', 'starving', 'yemen']",14,5409,8462
388,Nancy Pelosi,House,Democrat,CA,12,2021-05-19 21:54:45.000000,"Americans deserve an impartial account of the January 6th attack on our democracy. Families of USCP officers, 9/11 Commission Chairs, 140 national security leaders & Representatives of both parties support a bipartisan commission, but Kevin McCarthy wants to hide the truth. What is he afraid of?",678,0,4645,0,NancyPelosi,Facebook,https://facebook.com/NancyPelosi/videos/4085566448158328,,,americans deserve impartial account january 6th attack democracy families uscp officers commission chairs national security leaders representatives parties support bipartisan commission kevin mccarthy wants hide truth afraid,"['americans', 'deserve', 'impartial', 'account', 'january', '6th', 'attack', 'democracy', 'families', 'uscp', 'officers', 'commission', 'chairs', 'national', 'security', 'leaders', 'representatives', 'parties', 'support', 'bipartisan', 'commission', 'kevin', 'mccarthy', 'wants', 'hide', 'truth', 'afraid']",09,5323,16409
189,Ted Cruz,Senate,Republican,TX,,2021-05-20 13:28:17.000000,no text,560,1512,2732,0,SenatorTedCruz,Facebook,https://facebook.com/SenatorTedCruz/posts/3923262937785977,,https://www.foxnews.com/politics/ted-cruz-biden-rewarded-russia-for-hacking-us-pipeline-by-blessing-russian-one,text,['text'],10,4804,25575
208,Tim Scott,Senate,Republican,SC,,2021-05-20 11:47:01.000000,"It has never been more important to instill greater voter confidence in our elections. Yet, Democrats—aided by liberal media content to echo their talking points—continue to ignore the facts in favor of shameful political maneuvers.

Democrats are attempting to rewrite the rules to take control away from state and local officials and put the federal government in charge. This unethical approach to nationalizing elections is inconsistent with the Constitution and inconsistent with commonsense. It doesn’t take an expert to realize the needs of New York are different from the needs of South Carolina.

Their plan would make fraud harder to detect by allowing unlimited ballot harvesting all across the country. Each election year there are stories of political operatives succumbing to the temptation to tamper with ballots they’re paid to collect.

As a Black man who has voted in the South all my life, voting rights are personal to me!

FOXNEWS.COM
Sen. Tim Scott: S.1 is not a voting rights bill, it's a partisan power grab that will harm faith in elections",386,496,3528,0,SenatorTimScott,Facebook,https://facebook.com/SenatorTimScott/posts/4316077658424333,,https://buff.ly/3wop8Uy,never important instill greater voter confidence elections yet democratsaided liberal media content echo talking pointscontinue ignore facts favor shameful political maneuversdemocrats attempting rewrite rules take control away state local officials put federal government charge unethical approach nationalizing elections inconsistent constitution inconsistent commonsense doesnt take expert realize needs new york different needs south carolinatheir plan would make fraud harder detect allowing unlimited ballot harvesting across country election year stories political operatives succumbing temptation tamper ballots theyre paid collectas black man voted south life voting rights personal mefoxnewscomsen tim scott s1 voting rights bill partisan power grab harm faith elections,"['never', 'important', 'instill', 'greater', 'voter', 'confidence', 'elections', 'yet', 'democratsaided', 'liberal', 'media', 'content', 'echo', 'talking', 'pointscontinue', 'ignore', 'facts', 'favor', 'shameful', 'political', 'maneuversdemocrats', 'attempting', 'rewrite', 'rules', 'take', 'control', 'away', 'state', 'local', 'officials', 'put', 'federal', 'government', 'charge', 'unethical', 'approach', 'nationalizing', 'elections', 'inconsistent', 'constitution', 'inconsistent', 'commonsense', 'doesnt', 'take', 'expert', 'realize', 'needs', 'new', 'york', 'different', 'needs', 'south', 'carolinatheir', 'plan', 'would', 'make', 'fraud', 'harder', 'detect', 'allowing', 'unlimited', 'ballot', 'harvesting', 'across', 'country', 'election', 'year', 'stories', 'political', 'operatives', 'succumbing', 'temptation', 'tamper', 'ballots', 'theyre', 'paid', 'collectas', 'black', 'man', 'voted', 'south', 'life', 'voting', 'rights', 'personal', 'mefoxnewscomsen', 'tim', 'scott', 's1', 'voting', 'rights', 'bill', 'partisan', 'power', 'grab', 'harm', 'faith', 'elections']",27,4410,19967
159,Rand Paul,Senate,Republican,KY,,2021-05-20 15:35:06.000000,"Every sovereign nation should be allowed to defend themselves.

PAUL.SENATE.GOV
Dr. Rand Paul Joins Resolution to Support Israel, Condemn Hamas Terrorists | Senator Rand Paul",229,249,3906,0,SenatorRandPaul,Facebook,https://facebook.com/SenatorRandPaul/posts/4296720653714038,,https://www.paul.senate.gov/news/dr-rand-paul-joins-resolution-support-israel-condemn-hamas-terrorists,every sovereign nation allowed defend themselvespaulsenategovdr rand paul joins resolution support israel condemn hamas terrorists senator rand paul,"['every', 'sovereign', 'nation', 'allowed', 'defend', 'themselvespaulsenategovdr', 'rand', 'paul', 'joins', 'resolution', 'support', 'israel', 'condemn', 'hamas', 'terrorists', 'senator', 'rand', 'paul']",18,4384,126933
348,Jim Jordan,House,Republican,OH,4,2021-05-20 12:21:38.000000,no text,416,0,3762,0,repjimjordan,Facebook,https://facebook.com/repjimjordan/videos/868183917099590,,,text,['text'],10,4178,25575
137,Christopher Murphy,Senate,Democrat,CT,,2021-05-20 16:45:35.000000,"Got into Bradley Airport and down by baggage claim a guy did a beeline for me.

“I’m a gun advocate! And you’re killing us, Chris!”

“But what about background checks? Making sure all commercial sales come with a check?”

“Well, I’m for THAT! That’s not what I’m talking about.”

He didn’t like red flag laws and had heard about “taxes” on guns.

He was very nice and polite, even if he was a little pissed.

Just shows how much common ground there is on background checks. Even the gun guys who corner their Senator at the airport want background checks.",173,0,3672,0,chrismurphyct,Facebook,https://facebook.com/chrismurphyct/posts/10158795833593961,,,got bradley airport baggage claim guy beeline meim gun advocate youre killing us chrisbut background checks making sure commercial sales come checkwell im thats im talking abouthe didnt like red flag laws heard taxes gunshe nice polite even little pissedjust shows much common ground background checks even gun guys corner senator airport want background checks,"['got', 'bradley', 'airport', 'baggage', 'claim', 'guy', 'beeline', 'meim', 'gun', 'advocate', 'youre', 'killing', 'us', 'chrisbut', 'background', 'checks', 'making', 'sure', 'commercial', 'sales', 'come', 'checkwell', 'im', 'thats', 'im', 'talking', 'abouthe', 'didnt', 'like', 'red', 'flag', 'laws', 'heard', 'taxes', 'gunshe', 'nice', 'polite', 'even', 'little', 'pissedjust', 'shows', 'much', 'common', 'ground', 'background', 'checks', 'even', 'gun', 'guys', 'corner', 'senator', 'airport', 'want', 'background', 'checks']",12,3845,8539
106,Elizabeth Warren,Senate,Democrat,MA,,2021-05-20 19:38:31.000000,"Racist policies have robbed Black farmers of opportunity for decades – that’s why Senator Cory Booker and I have the Justice for Black Farmers Act. Heaven forbid we start to address that problem because it might be just a smidge inconvenient for wealthy bankers.

NYTIMES.COM
Banks Fight $4 Billion Debt Relief Plan for Black Farmers",198,725,2800,0,senatorelizabethwarren,Facebook,https://facebook.com/senatorelizabethwarren/posts/1848583568637461,,https://www.nytimes.com/2021/05/19/us/politics/black-farmers-debt-relief.html,racist policies robbed black farmers opportunity decades thats senator cory booker justice black farmers act heaven forbid start address problem might smidge inconvenient wealthy bankersnytimescombanks fight billion debt relief plan black farmers,"['racist', 'policies', 'robbed', 'black', 'farmers', 'opportunity', 'decades', 'thats', 'senator', 'cory', 'booker', 'justice', 'black', 'farmers', 'act', 'heaven', 'forbid', 'start', 'address', 'problem', 'might', 'smidge', 'inconvenient', 'wealthy', 'bankersnytimescombanks', 'fight', 'billion', 'debt', 'relief', 'plan', 'black', 'farmers']",08,3723,8964
233,Jeff Merkley,Senate,Democrat,OR,,2021-05-20 09:55:58.000000,"Senators have silently blocked legislation from being debated and have stood in the way of the American people’s agenda without needing to explain themselves for too long. “The filibuster is nowhere in the Constitution, and in fact some of the Founders even worried about the minority having veto power over the will of the majority[.]”

We’re at an inflection point in our country. The American people voted for progress in 2020, and we need to deliver for them. That’s going to take reforming or eliminating the filibuster, and I’m ready to get the job done.

ROLLINGSTONE.COM
How Democrats Learned to Stop Worrying and Love Nuking the Filibuster",286,394,2865,0,jeffmerkley,Facebook,https://facebook.com/jeffmerkley/posts/10158078890041546,,https://www.rollingstone.com/politics/politics-features/democrats-filibuster-biden-mcconnell-manchin-1168837/,senators silently blocked legislation debated stood way american peoples agenda without needing explain long filibuster nowhere constitution fact founders even worried minority veto power majoritywere inflection point country american people voted progress need deliver thats going take reforming eliminating filibuster im ready get job donerollingstonecomhow democrats learned stop worrying love nuking filibuster,"['senators', 'silently', 'blocked', 'legislation', 'debated', 'stood', 'way', 'american', 'peoples', 'agenda', 'without', 'needing', 'explain', 'long', 'filibuster', 'nowhere', 'constitution', 'fact', 'founders', 'even', 'worried', 'minority', 'veto', 'power', 'majoritywere', 'inflection', 'point', 'country', 'american', 'people', 'voted', 'progress', 'need', 'deliver', 'thats', 'going', 'take', 'reforming', 'eliminating', 'filibuster', 'im', 'ready', 'get', 'job', 'donerollingstonecomhow', 'democrats', 'learned', 'stop', 'worrying', 'love', 'nuking', 'filibuster']",12,3545,8539
274,Nancy Pelosi,House,Democrat,CA,12,2021-05-20 17:04:06.000000,"Some Republicans want to pretend the January 6th attack on our Democracy was a ‘normal day.’ Their denial dishonors the officers who lost their lives defending the Capitol, the staff & workers who make our country run and our Constitution. We need strong action to secure our Democracy.",515,0,2967,0,NancyPelosi,Facebook,https://facebook.com/NancyPelosi/videos/508765846962636,,,republicans want pretend january 6th attack democracy normal day denial dishonors officers lost lives defending capitol staff workers make country run constitution need strong action secure democracy,"['republicans', 'want', 'pretend', 'january', '6th', 'attack', 'democracy', 'normal', 'day', 'denial', 'dishonors', 'officers', 'lost', 'lives', 'defending', 'capitol', 'staff', 'workers', 'make', 'country', 'run', 'constitution', 'need', 'strong', 'action', 'secure', 'democracy']",09,3482,16409
225,Bernard Sanders,Senate,Independent,VT,,2021-05-20 10:28:50.000000,"Our health care system is dysfunctional in many ways, but one of the most critical is that our country is facing a major doctor shortage. We're holding a hearing NOW on what Congress can do about it.",839,552,1789,0,senatorsanders,Facebook,https://facebook.com/senatorsanders/videos/782868599259952,,,health care system dysfunctional many ways one critical country facing major doctor shortage holding hearing congress,"['health', 'care', 'system', 'dysfunctional', 'many', 'ways', 'one', 'critical', 'country', 'facing', 'major', 'doctor', 'shortage', 'holding', 'hearing', 'congress']",24,3180,8411
