,name,chamber,party,state,district,date,content,replyCount,retweetCount,likeCount,quoteCount,handle,platform,url,photos,news,text,toke,topic,enga,engaSum
153,Joni Ernst,Senate,Republican,IA,,2021-05-20 16:03:11.000000,"Thousands of Iowans have proudly served in Afghanistan, risking their lives to deliver justice to the terrorists who attacked our nation and to reduce the threat of future attacks.

Today at a Senate Armed Services Committee hearing, I pressed military leaders about the potential dangers of the Biden Administration's Afghanistan withdrawal plan.",39,0,43,0,senjoniernst,Facebook,https://facebook.com/senjoniernst/videos/586245992344801,,,thousands iowans proudly served afghanistan risking lives deliver justice terrorists attacked nation reduce threat future attackstoday senate armed services committee hearing pressed military leaders potential dangers biden administrations afghanistan withdrawal plan,"['thousands', 'iowans', 'proudly', 'served', 'afghanistan', 'risking', 'lives', 'deliver', 'justice', 'terrorists', 'attacked', 'nation', 'reduce', 'threat', 'future', 'attackstoday', 'senate', 'armed', 'services', 'committee', 'hearing', 'pressed', 'military', 'leaders', 'potential', 'dangers', 'biden', 'administrations', 'afghanistan', 'withdrawal', 'plan']",20,82,1766
160,Susan M. Collins,Senate,Republican,ME,,2021-05-20 15:33:47.000000,"Lewiston has been awarded more than $30 million to redevelop its Tree Streets neighborhood. This investment will transform a neighborhood with the highest concentration of childhood lead poisoning and families in poverty and Maine’s lowest performing schools into a lead-free, economically diverse, and welcoming community.

As the Ranking Member of the Housing Appropriations Committee, I championed Lewiston’s grant application and spoke directly with HUD leaders about the monumental impact the project will have on the health, safety, and overall wellbeing of Mainers.

SUNJOURNAL.COM
Lewiston awarded $30 million Choice Neighborhoods redevelopment grant",25,3,53,0,susancollins,Facebook,https://facebook.com/susancollins/posts/10160859703293362,,https://www.sunjournal.com/2021/05/20/lewiston-awarded-30-million-choice-neighborhoods-redevelopment-grant/,lewiston awarded million redevelop tree streets neighborhood investment transform neighborhood highest concentration childhood lead poisoning families poverty maines lowest performing schools leadfree economically diverse welcoming communityas ranking member housing appropriations committee championed lewistons grant application spoke directly hud leaders monumental impact project health safety overall wellbeing mainerssunjournalcomlewiston awarded million choice neighborhoods redevelopment grant,"['lewiston', 'awarded', 'million', 'redevelop', 'tree', 'streets', 'neighborhood', 'investment', 'transform', 'neighborhood', 'highest', 'concentration', 'childhood', 'lead', 'poisoning', 'families', 'poverty', 'maines', 'lowest', 'performing', 'schools', 'leadfree', 'economically', 'diverse', 'welcoming', 'communityas', 'ranking', 'member', 'housing', 'appropriations', 'committee', 'championed', 'lewistons', 'grant', 'application', 'spoke', 'directly', 'hud', 'leaders', 'monumental', 'impact', 'project', 'health', 'safety', 'overall', 'wellbeing', 'mainerssunjournalcomlewiston', 'awarded', 'million', 'choice', 'neighborhoods', 'redevelopment', 'grant']",03,81,7807
101,Debbie Stabenow,Senate,Democrat,MI,,2021-05-20 21:35:16.000000,"This week Congress passed the COVID-19 Hate Crimes Act to address the rise in hate crimes and #StopAsianHate. I am glad President Joe Biden has officially signed this critical legislation into law.

The White House
14 hrs ·

Standing, together, against hate is a core American value. Today the President signed the COVID-19 Hate Crimes Act and made it clear: hate has no place here.",10,2,68,0,SenatorStabenow,Facebook,https://facebook.com/SenatorStabenow/posts/880634762488735,,,week congress passed covid19 hate crimes act address rise hate crimes stopasianhate glad president joe biden officially signed critical legislation lawthe white house14 hrs standing together hate core american value today president signed covid19 hate crimes act made clear hate place,"['week', 'congress', 'passed', 'covid19', 'hate', 'crimes', 'act', 'address', 'rise', 'hate', 'crimes', 'stopasianhate', 'glad', 'president', 'joe', 'biden', 'officially', 'signed', 'critical', 'legislation', 'lawthe', 'white', 'house14', 'hrs', 'standing', 'together', 'hate', 'core', 'american', 'value', 'today', 'president', 'signed', 'covid19', 'hate', 'crimes', 'act', 'made', 'clear', 'hate', 'place']",17,80,12360
98,Brian J. Mast,House,Republican,FL,18,2021-05-20 00:30:00+00:00,"I’m urging President Biden to direct the head of the Army Corps to visit our community before the Army Corps poisons us once again.

This is the very least they can do! https://t.co/4LkkZD09LO",10,16,50,2,repbrianmast,Twitter,https://twitter.com/RepBrianMast/status/1395174935761350658,https://pbs.twimg.com/amplify_video_thumb/1395131750796439553/img/1fiIauEg6NGj70VD.jpg,[],im urging president biden direct head army corps visit community army corps poisons us againthis least,"['im', 'urging', 'president', 'biden', 'direct', 'head', 'army', 'corps', 'visit', 'community', 'army', 'corps', 'poisons', 'us', 'againthis', 'least']",08,78,8964
335,Grace F. Napolitano,House,Democrat,CA,32,2021-05-20 13:02:48.000000,"On this #MentalHealthAction Day, we proudly wear lime green to raise awareness, reduce stigma, elevate mental health, and increase funding, so services are available to anybody in need. It is always okay to ask for help!",9,0,69,0,RepGraceNapolitano,Facebook,https://facebook.com/RepGraceNapolitano/posts/3940949959291887,https://scontent-iad3-2.xx.fbcdn.net/v/t1.6435-9/fr/cp0/e15/q65/187429933_3940949889291894_9122870638068674889_n.jpg?_nc_cat=100&ccb=1-3&_nc_sid=110474&_nc_ohc=mXrwDOV7KOMAX_-ZbRb&_nc_ht=scontent-iad3-2.xx&tp=14&oh=f27772a73630e6507d0b11850fed1124&oe=60CAA518,,mentalhealthaction day proudly wear lime green raise awareness reduce stigma elevate mental health increase funding services available anybody need always okay ask help,"['mentalhealthaction', 'day', 'proudly', 'wear', 'lime', 'green', 'raise', 'awareness', 'reduce', 'stigma', 'elevate', 'mental', 'health', 'increase', 'funding', 'services', 'available', 'anybody', 'need', 'always', 'okay', 'ask', 'help']",24,78,8411
367,Mario Diaz-Balart,House,Republican,FL,25,2021-05-20 10:16:23.000000,"En el 119º aniversario de la Independencia de #Cuba, me solidarizo con la republica que nació ese #20demayo, y con los valientes activistas que luchan hoy por la libertad y los derechos humanos.",17,0,60,0,mdiazbalart,Facebook,https://facebook.com/mdiazbalart/videos/948677309230125,,,en el aniversario de la independencia de cuba solidarizo con la republica que naci ese 20demayo con los valientes activistas que luchan hoy por la libertad los derechos humanos,"['en', 'el', 'aniversario', 'de', 'la', 'independencia', 'de', 'cuba', 'solidarizo', 'con', 'la', 'republica', 'que', 'naci', 'ese', '20demayo', 'con', 'los', 'valientes', 'activistas', 'que', 'luchan', 'hoy', 'por', 'la', 'libertad', 'los', 'derechos', 'humanos']",14,77,8462
420,House Committee on Oversight and Reform,House,N/A,N/A,N/A,2021-05-20 20:12:14+00:00,#NEW: @OversightDems Chair @RepMaloney and @HomelandDems Chair @BennieGThompson released this statement on news that @DHSgov's @SecMayorkas has ordered @ICEgov to sever its ties with the Irwin County Detention Center:,1,22,52,2,oversightdems,Twitter,https://twitter.com/OversightDems/status/1395472454001336324,,[],new chair chair released statement news ordered sever ties irwin county detention center,"['new', 'chair', 'chair', 'released', 'statement', 'news', 'ordered', 'sever', 'ties', 'irwin', 'county', 'detention', 'center']",22,77,14378
337,Mario Diaz-Balart,House,Republican,FL,25,2021-05-20 12:55:31.000000,"I'm proud to have joined Leader Kevin McCarthy and colleagues this morning in a press conference recognizing Cuban Independence Day and reaffirming our commitment to supporting all those fighting for democracy in Cuba and around the world. https://youtu.be/G290OuWOnVs

YOUTUBE.COM
Leader McCarthy and Republicans Hold a Cuban Independence Day News Event",16,5,54,0,mdiazbalart,Facebook,https://facebook.com/mdiazbalart/posts/5405224276215907,,https://youtu.be/G290OuWOnVs,im proud joined leader kevin mccarthy colleagues morning press conference recognizing cuban independence day reaffirming commitment supporting fighting democracy cuba around world youtubecomleader mccarthy republicans hold cuban independence day news event,"['im', 'proud', 'joined', 'leader', 'kevin', 'mccarthy', 'colleagues', 'morning', 'press', 'conference', 'recognizing', 'cuban', 'independence', 'day', 'reaffirming', 'commitment', 'supporting', 'fighting', 'democracy', 'cuba', 'around', 'world', 'youtubecomleader', 'mccarthy', 'republicans', 'hold', 'cuban', 'independence', 'day', 'news', 'event']",06,75,2849
280,Gus M. Bilirakis,House,Republican,FL,12,2021-05-20 16:49:13.000000,"Secretary Xavier Becerra gave false testimony in last week's hearing when he claimed that there is no current law against partial birth abortions. There have been many recent attempts to erode federal protections for life. I will continue to expose those actions and to hold this Administration accountable for following the current laws to protect the unborn.

POLITIFACT.COM
PolitiFact - Xavier Becerra is wrong that no law addresses partial-birth abortion",36,3,35,0,GusBilirakis,Facebook,https://facebook.com/GusBilirakis/posts/4574204952609623,,https://www.politifact.com/factchecks/2021/may/19/xavier-becerra/xavier-becerra-wrong-no-law-deals-partial-birth-ab/,secretary xavier becerra gave false testimony last weeks hearing claimed current law partial birth abortions many recent attempts erode federal protections life continue expose actions hold administration accountable following current laws protect unbornpolitifactcompolitifact xavier becerra wrong law addresses partialbirth abortion,"['secretary', 'xavier', 'becerra', 'gave', 'false', 'testimony', 'last', 'weeks', 'hearing', 'claimed', 'current', 'law', 'partial', 'birth', 'abortions', 'many', 'recent', 'attempts', 'erode', 'federal', 'protections', 'life', 'continue', 'expose', 'actions', 'hold', 'administration', 'accountable', 'following', 'current', 'laws', 'protect', 'unbornpolitifactcompolitifact', 'xavier', 'becerra', 'wrong', 'law', 'addresses', 'partialbirth', 'abortion']",25,74,27034
385,Lucille Roybal-Allard,House,Democrat,CA,40,2021-05-19 22:49:18.000000,"On January 6, 2021, insurrectionists attacked the U.S. Capitol Building - the heart of our democracy. Today I voted for the National Commission to Investigate the January 6 Attack on the U.S. Capitol Complex Act to ensure we can protect the Capitol and those in it from future attacks.

This important legislation will establish an independent, bipartisan 9/11-type commission to examine and report upon the facts, causes and security relating to the January 6 insurrection.

The horrific events of that day made it clear that better security is needed to protect Members, employees, and visitors to the U.S. Capitol. It's crucial that we learn more about what happened on January 6 and take action to ensure that similar attacks will never ever happen again.

El 6 de enero de 2021, los insurrectos atacaron el edificio del Capitolio de los Estados Unidos, el corazón de nuestra democracia. Hoy voté a favor del Acta de la Comisión Nacional para Investigar el Ataque del 6 de enero contra el Complejo del Capitolio de los EE. UU. para garantizar que podamos proteger al Capitolio y a sus habitantes de ataques futuros.

Esta legislación importante establecerá una comisión bipartidista e independiente del tipo 9/11 para examinar e informar sobre los hechos, las causas y la seguridad relacionados con la insurrección del 6 de enero.

Los horribles eventos de ese día dejaron en claro que se necesita una mayor seguridad para proteger a los Congresistas, empleados y visitantes del Capitolio de los EE. UU. Es crucial que aprendamos más sobre lo que sucedió el 6 de enero y tomemos medidas para garantizar que nunca más vuelvan a ocurrir ataques similares.",14,0,58,0,RepRoybalAllard,Facebook,https://facebook.com/RepRoybalAllard/posts/4539485222732637,,,january insurrectionists attacked us capitol building heart democracy today voted national commission investigate january attack us capitol complex act ensure protect capitol future attacksthis important legislation establish independent bipartisan 911type commission examine report upon facts causes security relating january insurrectionthe horrific events day made clear better security needed protect members employees visitors us capitol crucial learn happened january take action ensure similar attacks never ever happen againel de enero de los insurrectos atacaron el edificio del capitolio de los estados unidos el corazn de nuestra democracia hoy vot favor del acta de la comisin nacional para investigar el ataque del de enero contra el complejo del capitolio de los ee uu para garantizar que podamos proteger al capitolio sus habitantes de ataques futurosesta legislacin importante establecer una comisin bipartidista e independiente del tipo para examinar e informar sobre los hechos las causas la seguridad relacionados con la insurreccin del de enerolos horribles eventos de ese da dejaron en claro que se necesita una mayor seguridad para proteger los congresistas empleados visitantes del capitolio de los ee uu es crucial que aprendamos ms sobre lo que sucedi el de enero tomemos medidas para garantizar que nunca ms vuelvan ocurrir ataques similares,"['january', 'insurrectionists', 'attacked', 'us', 'capitol', 'building', 'heart', 'democracy', 'today', 'voted', 'national', 'commission', 'investigate', 'january', 'attack', 'us', 'capitol', 'complex', 'act', 'ensure', 'protect', 'capitol', 'future', 'attacksthis', 'important', 'legislation', 'establish', 'independent', 'bipartisan', '911type', 'commission', 'examine', 'report', 'upon', 'facts', 'causes', 'security', 'relating', 'january', 'insurrectionthe', 'horrific', 'events', 'day', 'made', 'clear', 'better', 'security', 'needed', 'protect', 'members', 'employees', 'visitors', 'us', 'capitol', 'crucial', 'learn', 'happened', 'january', 'take', 'action', 'ensure', 'similar', 'attacks', 'never', 'ever', 'happen', 'againel', 'de', 'enero', 'de', 'los', 'insurrectos', 'atacaron', 'el', 'edificio', 'del', 'capitolio', 'de', 'los', 'estados', 'unidos', 'el', 'corazn', 'de', 'nuestra', 'democracia', 'hoy', 'vot', 'favor', 'del', 'acta', 'de', 'la', 'comisin', 'nacional', 'para', 'investigar', 'el', 'ataque', 'del', 'de', 'enero', 'contra', 'el', 'complejo', 'del', 'capitolio', 'de', 'los', 'ee', 'uu', 'para', 'garantizar', 'que', 'podamos', 'proteger', 'al', 'capitolio', 'sus', 'habitantes', 'de', 'ataques', 'futurosesta', 'legislacin', 'importante', 'establecer', 'una', 'comisin', 'bipartidista', 'e', 'independiente', 'del', 'tipo', 'para', 'examinar', 'e', 'informar', 'sobre', 'los', 'hechos', 'las', 'causas', 'la', 'seguridad', 'relacionados', 'con', 'la', 'insurreccin', 'del', 'de', 'enerolos', 'horribles', 'eventos', 'de', 'ese', 'da', 'dejaron', 'en', 'claro', 'que', 'se', 'necesita', 'una', 'mayor', 'seguridad', 'para', 'proteger', 'los', 'congresistas', 'empleados', 'visitantes', 'del', 'capitolio', 'de', 'los', 'ee', 'uu', 'es', 'crucial', 'que', 'aprendamos', 'ms', 'sobre', 'lo', 'que', 'sucedi', 'el', 'de', 'enero', 'tomemos', 'medidas', 'para', 'garantizar', 'que', 'nunca', 'ms', 'vuelvan', 'ocurrir', 'ataques', 'similares']",27,72,19967
206,Debbie Stabenow,Senate,Democrat,MI,,2021-05-20 11:52:53.000000,"School-based health centers play a critical role in providing care to so many children who don’t have access to a family doctor. They are also meeting a critical need for mental health services for children impacted by the COVID-19 crisis. My new bill will make sure health center staff have the resources needed to provide these important services to students. https://www.stabenow.senate.gov/news/senator-stabenow-introduces-new-bipartisan-bill-to-improve-childrens-physical-health-and-mental-health-by-investing-in-school-based-health-centers

STABENOW.SENATE.GOV
Senator Stabenow Introduces New Bipartisan Bill to Improve Children’s Physical Health and Mental Health by Investing in School-Based Health Centers | U.S. Senator Debbie Stabenow of Michigan",12,9,49,0,SenatorStabenow,Facebook,https://facebook.com/SenatorStabenow/posts/880416179177260,,https://www.stabenow.senate.gov/news/senator-stabenow-introduces-new-bipartisan-bill-to-improve-childrens-physical-health-and-mental-health-by-investing-in-school-based-health-centers,schoolbased health centers play critical role providing care many children dont access family doctor also meeting critical need mental health services children impacted covid19 crisis new bill make sure health center staff resources needed provide important services students stabenowsenategovsenator stabenow introduces new bipartisan bill improve childrens physical health mental health investing schoolbased health centers us senator debbie stabenow michigan,"['schoolbased', 'health', 'centers', 'play', 'critical', 'role', 'providing', 'care', 'many', 'children', 'dont', 'access', 'family', 'doctor', 'also', 'meeting', 'critical', 'need', 'mental', 'health', 'services', 'children', 'impacted', 'covid19', 'crisis', 'new', 'bill', 'make', 'sure', 'health', 'center', 'staff', 'resources', 'needed', 'provide', 'important', 'services', 'students', 'stabenowsenategovsenator', 'stabenow', 'introduces', 'new', 'bipartisan', 'bill', 'improve', 'childrens', 'physical', 'health', 'mental', 'health', 'investing', 'schoolbased', 'health', 'centers', 'us', 'senator', 'debbie', 'stabenow', 'michigan']",24,70,8411
118,Jeff Merkley,Senate,Democrat,OR,,2021-05-20 18:26:41.000000,"I’m joining other U.S. Senate Democrats to celebrate #AAPIHeritageMonth and highlight some of our AAPI community members who are making a difference. I want to honor Mark Mitsui, Portland Community College President.

Mark’s work has opened the doors of opportunity for thousands of students. He’s taken the lead on national policy at the Department of Education under President Obama, and his work as president of PCC has strengthened our communities and workforce here in Oregon.

Mark—Thank you for all you do and all you’ve done, and keep up the good work!

DIVERSEEDUCATION.COM
A Consequential Leader: Q&A With Mark Mitsui, President of Portland Community College - Higher Education",5,2,63,0,jeffmerkley,Facebook,https://facebook.com/jeffmerkley/posts/10158079685561546,,https://diverseeducation.com/article/214272/,im joining us senate democrats celebrate aapiheritagemonth highlight aapi community members making difference want honor mark mitsui portland community college presidentmarks work opened doors opportunity thousands students hes taken lead national policy department education president obama work president pcc strengthened communities workforce oregonmarkthank youve done keep good workdiverseeducationcoma consequential leader qa mark mitsui president portland community college higher education,"['im', 'joining', 'us', 'senate', 'democrats', 'celebrate', 'aapiheritagemonth', 'highlight', 'aapi', 'community', 'members', 'making', 'difference', 'want', 'honor', 'mark', 'mitsui', 'portland', 'community', 'college', 'presidentmarks', 'work', 'opened', 'doors', 'opportunity', 'thousands', 'students', 'hes', 'taken', 'lead', 'national', 'policy', 'department', 'education', 'president', 'obama', 'work', 'president', 'pcc', 'strengthened', 'communities', 'workforce', 'oregonmarkthank', 'youve', 'done', 'keep', 'good', 'workdiverseeducationcoma', 'consequential', 'leader', 'qa', 'mark', 'mitsui', 'president', 'portland', 'community', 'college', 'higher', 'education']",08,70,8964
131,Robert Menendez,Senate,Democrat,NJ,,2021-05-20 17:17:58.000000,"New Jersey is in the midst of a ""judicial emergency"" with six federal court vacancies.

Today we moved a step closer to ending that emergency and building a federal bench that looks like the rest of America.

Thank you to the Senate Judiciary Committee for advancing these superb nominees.",9,0,60,0,senatormenendez,Facebook,https://facebook.com/senatormenendez/posts/10159257626766358,https://scontent-iad3-2.xx.fbcdn.net/v/t1.6435-9/184621685_10159257624801358_827801964004661560_n.png?_nc_cat=107&ccb=1-3&_nc_sid=8024bb&_nc_ohc=a16sRLu1A5kAX-LZAHt&_nc_ht=scontent-iad3-2.xx&oh=4bb25ec7ec9383131c3dfa6e97437f2f&oe=60CBBD28,,new jersey midst judicial emergency six federal court vacanciestoday moved step closer ending emergency building federal bench looks like rest americathank senate judiciary committee advancing superb nominees,"['new', 'jersey', 'midst', 'judicial', 'emergency', 'six', 'federal', 'court', 'vacanciestoday', 'moved', 'step', 'closer', 'ending', 'emergency', 'building', 'federal', 'bench', 'looks', 'like', 'rest', 'americathank', 'senate', 'judiciary', 'committee', 'advancing', 'superb', 'nominees']",03,69,7807
51,Kevin Hern,House,Republican,OK,1,2021-05-20 19:21:36+00:00,I strongly support our ally Israel as they continue to defend themselves from Hamas terrorists. This sign hangs proudly over the door to my DC office – I join many of my colleagues who are putting our support for Israel front and center! https://t.co/8KGqg7mljc,15,11,40,1,repkevinhern,Twitter,https://twitter.com/repkevinhern/status/1395459712771137544,https://pbs.twimg.com/media/E12rLReXEAI3eSQ?format=jpg&name=small,[],strongly support ally israel continue defend hamas terrorists sign hangs proudly door dc office join many colleagues putting support israel front center,"['strongly', 'support', 'ally', 'israel', 'continue', 'defend', 'hamas', 'terrorists', 'sign', 'hangs', 'proudly', 'door', 'dc', 'office', 'join', 'many', 'colleagues', 'putting', 'support', 'israel', 'front', 'center']",18,67,126933
45,Stacey E. Plaskett,House,Democrat,VI,0,2021-05-20 19:44:57+00:00,"Tune in tonight at 8pm on @WTJX to watch ""The Washington Report with Stacey Plaskett"" as we discuss what's in the American Rescue Plan. https://t.co/vl0QH2N1HQ",0,9,57,0,staceyplaskett,Twitter,https://twitter.com/StaceyPlaskett/status/1395465586759671810,https://pbs.twimg.com/media/E12whxpWQAQazdB?format=jpg&name=small,[],tune tonight 8pm watch washington report stacey plaskett discuss whats american rescue plan,"['tune', 'tonight', '8pm', 'watch', 'washington', 'report', 'stacey', 'plaskett', 'discuss', 'whats', 'american', 'rescue', 'plan']",23,66,667
128,Mark Kelly,Senate,Democrat,AZ,,2021-05-20 17:37:26.000000,"Arizona is poised to lead the way as we expand semiconductor manufacturing capacity in America, but to do that, we must continue training to our workforce for these high-paying jobs.

ABC15.COM
Preparing the workforce for Arizona's recent boom in technology careers",3,4,59,0,SenMarkKelly,Facebook,https://facebook.com/SenMarkKelly/posts/233669351888266,,https://www.abc15.com/news/state-of-education/preparing-the-workforce-for-arizonas-recent-boom-in-technology-careers,arizona poised lead way expand semiconductor manufacturing capacity america must continue training workforce highpaying jobsabc15compreparing workforce arizonas recent boom technology careers,"['arizona', 'poised', 'lead', 'way', 'expand', 'semiconductor', 'manufacturing', 'capacity', 'america', 'must', 'continue', 'training', 'workforce', 'highpaying', 'jobsabc15compreparing', 'workforce', 'arizonas', 'recent', 'boom', 'technology', 'careers']",08,66,8964
260,Gwen Moore,House,Democrat,WI,4,2021-05-20 18:46:46.000000,"My lived experiences as a poor, single teenage mother inform my work today. We need to address the poverty crisis that existed before COVID, which has only worsened.

It was my honor to join Rev. Barber, Rev. Liz Theoharis and my colleagues in unveiling a bill that answers this urgent need.",2,0,63,0,GwenSMoore,Facebook,https://facebook.com/GwenSMoore/posts/10161270747774546,https://scontent-iad3-2.xx.fbcdn.net/v/t1.6435-9/fr/cp0/e15/q65/188656711_10161270746434546_8783074810018002833_n.jpg?_nc_cat=104&ccb=1-3&_nc_sid=8024bb&_nc_ohc=coRXxm1hcxIAX-59K6b&_nc_ht=scontent-iad3-2.xx&tp=14&oh=8599fa2cfd79f7462294b47d38ca140e&oe=60CC45B9,,lived experiences poor single teenage mother inform work today need address poverty crisis existed covid worsenedit honor join rev barber rev liz theoharis colleagues unveiling bill answers urgent need,"['lived', 'experiences', 'poor', 'single', 'teenage', 'mother', 'inform', 'work', 'today', 'need', 'address', 'poverty', 'crisis', 'existed', 'covid', 'worsenedit', 'honor', 'join', 'rev', 'barber', 'rev', 'liz', 'theoharis', 'colleagues', 'unveiling', 'bill', 'answers', 'urgent', 'need']",19,65,534
